### ISSUE TITLE
Support OnlyLocal annotation on Kubernetes

### ISSUE THREAD

**Issue by caseydavenport** [coreos/flannel#734]
As discussed in this issue: https://github.com/kubernetes/kubernetes/issues/44963

## Expected Behavior
Flannel should not perform MASQUERADE on external traffic which arrives on a Node that owns the targeted container/pod IP address.

## Current Behavior
Flannel currently adds a MASQUERADE rule which masks any traffic from outside the container network destined to the container network as a means of bridging traffic onto the overlay. 

## Possible Solution
This is currently done by this rule: https://github.com/coreos/flannel/blob/master/network/ipmasq.go#L36

One hastily thought out solution might be to add a rule prior to that which returns if the destination belongs to the subnet allocation for that particular Node.

e.g.

```
-A POSTROUTING ! -s 10.244.0.0/16 -d 10.244.1.0/24 -j RETURN
-A POSTROUTING ! -s 10.244.0.0/16 -d 10.244.0.0/16 -j MASQUERADE
```

## Steps to Reproduce (for bugs)
See the linked issue.

## Context
See the linked issue.

## Your Environment
See the linked issue.

**Comment by manuperera** [comment]
Thanks for the workaround. 
Do you know if the next version of flannel (0.8) will fix this problem?

**Comment by somejfn** [comment]
Workaround works for me too. I have great interest in this as we can make some real use of advanced policies and CIDR selectors in an ingress rule.

**Comment by manuperera** [comment]
I've tested the possible solution mentioned in https://github.com/coreos/flannel/blob/master/network/ipmasq.go#L36, but not working.

I will write again in this issue the tests details by request of @MrHohn. [https://github.com/kubernetes/kubernetes/issues/52096](url) .

I've installed the latest stable release of CoreOS (1548.0.0). This release contains Flanneld 0.9.0.

```
coreos002 ~ # more /etc/lsb-release 
DISTRIB_ID="Container Linux by CoreOS"
DISTRIB_RELEASE=1548.0.0
DISTRIB_CODENAME="Ladybug"
DISTRIB_DESCRIPTION="Container Linux by CoreOS 1548.0.0 (Ladybug)"
coreos002 ~ # /var/lib/rkt/cas/tree/deps-sha512-d422e9e7efc0d089bfcf581cac189d39513a6fd421269aa31f863c44ef96d9ff/rootfs/opt/bin/flanneld --version
v0.9.0
```

I've repeated tests over connector container and results are the same. Packets captured in Kubernetes's master nodo have correct IP address.

``` logs
13:34:00.340753 IP 172.19.18.53.35686 > coreos002.amplia.int.radius-acct: RADIUS, Accounting-Request (4), id: 0x48 length: 166
13:34:00.340880 IP 172.19.18.53.35686 > coreos002.amplia.int.radius-acct: RADIUS, Accounting-Request (4), id: 0x49 length: 151
13:34:01.241995 IP 172.19.18.53.35686 > coreos002.amplia.int.radius-acct: RADIUS, Accounting-Request (4), id: 0x4a length: 166
13:34:01.242135 IP 172.19.18.53.35686 > coreos002.amplia.int.radius-acct: RADIUS, Accounting-Request (4), id: 0x4b length: 151
13:34:02.142696 IP 172.19.18.53.35686 > coreos002.amplia.int.radius-acct: RADIUS, Accounting-Request (4), id: 0x4c length: 166
13:34:02.142817 IP 172.19.18.53.35686 > coreos002.amplia.int.radius-acct: RADIUS, Accounting-Request (4), id: 0x4d length: 151
13:34:02.538837 IP 172.19.18.53.35686 > coreos002.amplia.int.radius-acct: RADIUS, Accounting-Request (4), id: 0x4e length: 151
13:34:03.440217 IP 172.19.18.53.35686 > coreos002.amplia.int.radius-acct: RADIUS, Accounting-Request (4), id: 0x4f length: 151
13:34:04.341705 IP 172.19.18.53.35686 > coreos002.amplia.int.radius-acct: RADIUS, Accounting-Request (4), id: 0x50 length: 151
13:34:05.243232 IP 172.19.18.53.35686 > coreos002.amplia.int.radius-acct: RADIUS, Accounting-Request (4), id: 0x51 length: 151
```

But, packets captured in Docker container (Connector) don,t have client IP address.

```
13:34:00.343773 IP 10.1.7.0.35686 > perfconnector-ttqx8.radius-acct: RADIUS, Accounting-Request (4), id: 0x48 length: 166
13:34:00.343857 IP 10.1.7.0.35686 > perfconnector-ttqx8.radius-acct: RADIUS, Accounting-Request (4), id: 0x49 length: 151
13:34:01.245124 IP 10.1.7.0.35686 > perfconnector-ttqx8.radius-acct: RADIUS, Accounting-Request (4), id: 0x4a length: 166
13:34:01.245862 IP 10.1.7.0.35686 > perfconnector-ttqx8.radius-acct: RADIUS, Accounting-Request (4), id: 0x4b length: 151
13:34:02.145736 IP 10.1.7.0.35686 > perfconnector-ttqx8.radius-acct: RADIUS, Accounting-Request (4), id: 0x4c length: 166
13:34:02.146381 IP 10.1.7.0.35686 > perfconnector-ttqx8.radius-acct: RADIUS, Accounting-Request (4), id: 0x4d length: 151
13:34:02.541613 IP 10.1.7.0.35686 > perfconnector-ttqx8.radius-acct: RADIUS, Accounting-Request (4), id: 0x4e length: 151
13:34:03.443608 IP 10.1.7.0.35686 > perfconnector-ttqx8.radius-acct: RADIUS, Accounting-Request (4), id: 0x4f length: 151
13:34:04.344522 IP 10.1.7.0.35686 > perfconnector-ttqx8.radius-acct: RADIUS, Accounting-Request (4), id: 0x50 length: 151
13:34:05.246380 IP 10.1.7.0.35686 > perfconnector-ttqx8.radius-acct: RADIUS, Accounting-Request (4), id: 0x51 length: 151
```

I hope that somebody can I help me with this situation.

Regards.
