### ISSUE TITLE
Flannel not routing correctly

### ISSUE THREAD

**Issue by fgrzadkowski** [coreos/flannel#325]
I have a kubernetes cluster which uses flannel for overlay network. It seems it doesn't work:

I have a pod/container with IP ```10.1.75.2```. I can ping/curl it from a machine it runs on:
```
filipg@docker-node1:~$ curl 10.1.75.2:160
foo
```
The same thing does not work on other machine (master and other nodes):
```
$ curl 10.1.75.2:160
curl: (7) Failed to connect to 10.1.75.2 port 160: No route to host
```
I checked entries in etcd and they look correct:
```
filipg@docker-master:~$ docker -H unix:///var/run/docker-bootstrap.sock exec -t elated_einstein etcdctl ls /coreos.com/network/subnets
/coreos.com/network/subnets/10.1.20.0-24
/coreos.com/network/subnets/10.1.75.0-24
/coreos.com/network/subnets/10.1.61.0-24
/coreos.com/network/subnets/10.1.90.0-24
/coreos.com/network/subnets/10.1.103.0-24
filipg@docker-master:~$ docker -H unix:///var/run/docker-bootstrap.sock exec -t elated_einstein etcdctl get /coreos.com/network/subnets/10.1.75.0-24
{"PublicIP":"10.240.0.2","BackendType":"vxlan","BackendData":{"VtepMAC":"ee:84:9f:f3:57:3e"}}
```
All the nodes seem to be routable:
```
filipg@docker-master:~$ ping 10.240.0.2
PING 10.240.0.2 (10.240.0.2) 56(84) bytes of data.
64 bytes from 10.240.0.2: icmp_seq=1 ttl=64 time=0.938 ms
```
I'm kind of stuck here, so any hints are most appreciated :)

**Comment by bprashanth** [comment]
Providing some more context. Specifically this is using hyperkube, which bootstraps flannel in docker: https://github.com/kubernetes/kubernetes/blob/f94f6c48fdcb0c313d14ce852105465196b391fb/docs/getting-started-guides/docker-multinode/worker.md

I ran 2 containers (10.1.103.2, 10.1.75.8) on 2 nodes (10.240.0.5, 10.240.0.2). After trying to ping between them from 103.2 -> 75.8:

arp cache on 240.0.5:
```
10.1.75.8 dev flannel.1  FAILED
10.1.103.2 dev docker0 lladdr 02:42:0a:01:67:02 DELAY
10.240.0.1 dev eth0 lladdr 42:01:0a:f0:00:01 REACHABLE
```

Bridge database on 240.0.5:
```
01:00:5e:00:00:01 dev eth0 self permanent
33:33:00:00:00:01 dev flannel.1 self permanent
01:00:5e:00:00:01 dev flannel.1 self permanent
33:33:00:00:00:01 dev docker0 self permanent
01:00:5e:00:00:01 dev docker0 self permanent
02:42:c0:6b:46:32 dev docker0 vlan 1 master docker0 permanent
02:42:c0:6b:46:32 dev docker0 master docker0 permanent
7e:aa:cd:b1:c1:af dev vethb621ff8 vlan 1 master docker0 permanent
02:42:0a:01:67:02 dev vethb621ff8 master docker0 
7e:aa:cd:b1:c1:af dev vethb621ff8 master docker0 permanent
33:33:00:00:00:01 dev vethb621ff8 self permanent
01:00:5e:00:00:01 dev vethb621ff8 self permanent
```

I'm confused becaues I don't see the entries I'm expecting. The traffic leaves the container bridge, and the subnets match up, and docker is running with the right mtu/bip. Did I miss something obvious?

**Comment by eyakubovich** [comment]
It's not a firewall issue, is it? Can you confirm that UDP port 8472 is open between all the nodes.

**Comment by bprashanth** [comment]
All ports are allowed between nodes in the cluster. netstat -ulv on port 8473 worked between the nodes in question. Tcpdump on flannel during the ping just shows arp requests
```
$ ping 10.1.75.9
23:56:29.374944 ARP, Request who-has 10.1.75.9 tell 10.1.103.0, length 28
23:56:30.374957 ARP, Request who-has 10.1.75.9 tell 10.1.103.0, length 28
23:56:34.374948 ARP, Request who-has 10.1.75.9 tell 10.1.103.0, length 28
23:56:35.374948 ARP, Request who-has 10.1.75.9 tell 10.1.103.0, length 28
23:56:36.374949 ARP, Request who-has 10.1.75.9 tell 10.1.103.0, length 28
23:56:40.375006 ARP, Request who-has 10.1.75.9 tell 10.1.103.0, length 28
```

**Comment by eyakubovich** [comment]
Can you please provide flannel logs? Are you able to ping `flannel.1` interfaces just from the host? -- that is ping 10.1.75.0.

**Comment by bprashanth** [comment]
I noticed previous too that the logs are strangely quiet (I expected to see some miss log lines): https://gist.github.com/bprashanth/8b605c838117889b2400

Yes I can ping `flannel.1`

**Comment by eyakubovich** [comment]
@bprashanth sorry, just to make sure, you can ping a remote `flannel.1` from the host (not on the same host)?

Can you try v0.5.3? I think you are hitting this bug: https://github.com/coreos/flannel/pull/272

**Comment by bprashanth** [comment]
Ah, no I can't (I would be so confused if that worked). Yeah we're running flannel 0.5.0 and kernel 3.19.0-28-generic, @fgrzadkowski can you please upgrade flannel and update?

**Comment by fgrzadkowski** [comment]
Yes! Upgrading to 0.5.3 helped! Now I can ping pods running on different hosts. After downgrading back to 0.5.0 I again see the problem.

Thanks for help!

**Comment by bnevis-i** [comment]
Docker 1.13 also broke inter-container communications across hosts (https://github.com/docker/docker/issues/30338)
