### ISSUE TITLE
no routing between flannel.1 and docker0

### ISSUE THREAD

**Issue by TehesFR** [coreos/flannel#544]
# Context

I've installed a kubernetes cluster on 3 "Ubuntu 14" nodes (1 master, 2 minions) following this guide: http://kubernetes.io/docs/getting-started-guides/ubuntu/

Here is the config-default.sh file I've used. Nothing crazy.

```
export nodes=${nodes:-"root@10.70.10.21 root@10.70.10.22 root@10.70.10.23"}
roles=${roles:-"a i i"}
export roles_array=($roles)
export NUM_NODES=${NUM_NODES:-2}
export SERVICE_CLUSTER_IP_RANGE=${SERVICE_CLUSTER_IP_RANGE:-192.168.3.0/24}
export CNI_PLUGIN_CONF CNI_PLUGIN_EXES CNI_KUBELET_TRIGGER
CNI_PLUGIN_CONF=${CNI_PLUGIN_CONF:-""}
CNI_PLUGIN_EXES=${CNI_PLUGIN_EXES:-""}
CNI_KUBELET_TRIGGER=${CNI_KUBELET_TRIGGER:-networking}
export FLANNEL_NET=${FLANNEL_NET:-172.16.0.0/16}
export FLANNEL_BACKEND
FLANNEL_BACKEND=''
export FLANNEL_OTHER_NET_CONFIG
FLANNEL_OTHER_NET_CONFIG=${FLANNEL_OTHER_NET_CONFIG:-""}
export ADMISSION_CONTROL=NamespaceLifecycle,LimitRanger,ServiceAccount,DefaultStorageClass,ResourceQuota

export KUBELET_CONFIG=${KUBELET_CONFIG:-""}

SERVICE_NODE_PORT_RANGE=${SERVICE_NODE_PORT_RANGE:-"30000-32767"}

ENABLE_NODE_LOGGING=false
LOGGING_DESTINATION=${LOGGING_DESTINATION:-elasticsearch}

ENABLE_CLUSTER_LOGGING=false
ELASTICSEARCH_LOGGING_REPLICAS=${ELASTICSEARCH_LOGGING_REPLICAS:-1}

ENABLE_CLUSTER_MONITORING="${KUBE_ENABLE_CLUSTER_MONITORING:-true}"

DOCKER_OPTS=${DOCKER_OPTS:-""}
KUBE_PROXY_EXTRA_OPTS=${KUBE_PROXY_EXTRA_OPTS:-""}

ENABLE_CLUSTER_DNS="${KUBE_ENABLE_CLUSTER_DNS:-true}"
DNS_SERVER_IP=${DNS_SERVER_IP:-"192.168.3.10"}
DNS_DOMAIN=${DNS_DOMAIN:-"cluster.local"}
DNS_REPLICAS=${DNS_REPLICAS:-1}

ENABLE_DNS_HORIZONTAL_AUTOSCALER="${KUBE_ENABLE_DNS_HORIZONTAL_AUTOSCALER:-false}"

ENABLE_CLUSTER_UI="${KUBE_ENABLE_CLUSTER_UI:-true}"

PROXY_SETTING=${PROXY_SETTING:-""}

ALLOW_PRIVILEGED=${ALLOW_PRIVILEGED:-"true"}

DEBUG=${DEBUG:-"false"}

SSH_OPTS="-oPort=22 -oStrictHostKeyChecking=no -oUserKnownHostsFile=/dev/null -oLogLevel=ERROR"
```

Then I've done the:

    KUBERNETES_PROVIDER=ubuntu ./kube-up.sh
    cd ubuntu/ 
    KUBERNETES_PROVIDER=ubuntu ./deployAddons.sh

# Installed versions
Flannel 0.5.5 (same with Flannel 0.6.2)
Etcd 2.3.1
Kubectl 1.4.5

# Issue

The flannel overlay network doesn't seem to work correctly. 
If I go to http://10.70.10.21:8080/ui I get the response below:

    Error: 'dial tcp 172.16.31.2:9090: i/o timeout'
    Trying to reach: 'http://172.16.31.2:9090/'

If I try to "ping 172.16.31.2" from my kubernetes nodes, **it only works from the node where the pod is running**.

# Debugging

My dashboard pod with IP address 172.16.31.2 is located on my minion1.
I've launched a "ping 172.16.31.2" command from my master node and here is what I see with tcpdump on minion1:

```
tcpdump -i flannel.1 icmp
tcpdump: verbose output suppressed, use -v or -vv for full protocol decode
listening on flannel.1, link-type EN10MB (Ethernet), capture size 65535 bytes
15:32:58.623128 IP 172.16.92.0 > 172.16.31.2: ICMP echo request, id 6558, seq 12, length 64
15:32:59.631208 IP 172.16.92.0 > 172.16.31.2: ICMP echo request, id 6558, seq 13, length 64
15:33:00.639471 IP 172.16.92.0 > 172.16.31.2: ICMP echo request, id 6558, seq 14, length 64
```

```
tcpdump -i docker0 icmp
tcpdump: verbose output suppressed, use -v or -vv for full protocol decode
listening on docker0, link-type EN10MB (Ethernet), capture size 65535 bytes
^C
```

**It looks like the flannel.1 interface receives the ICMP request but doesn't route the packet to the docker0 interface ?**

Here are the route tables on each node:

Master:
```
default via 10.70.0.1 dev eth0
10.70.0.0/16 dev eth0  proto kernel  scope link  src 10.70.10.21
172.16.0.0/16 dev flannel.1  proto kernel  scope link  src 172.16.92.0
172.17.0.0/16 dev docker0  proto kernel  scope link  src 172.17.0.1
```
Minion1:
```
default via 10.70.0.1 dev eth0
10.70.0.0/16 dev eth0  proto kernel  scope link  src 10.70.10.22
172.16.0.0/16 dev flannel.1
172.16.31.0/24 dev docker0  proto kernel  scope link  src 172.16.31.1
```
Minion2:
```
default via 10.70.0.1 dev eth0
10.70.0.0/16 dev eth0  proto kernel  scope link  src 10.70.10.23
172.16.0.0/16 dev flannel.1
172.16.86.0/24 dev docker0  proto kernel  scope link  src 172.16.86.1
```

I'm struggling with this issue for 2 days now, am I doing something wrong or is something broken ?

Thanks a lot for your help.

**Comment by nkwangleiGIT** [comment]
We met with the same issue recently, any update about this issue? thanks!

**Comment by chulkilee** [comment]
I hit the same problem on manual installation - I made it work again by 1) stopping flannel and docker 2) remove stale `docker_opts.env` 3) start flannel and then docker.

**Comment by magicwang-cn** [comment]
+1

**Comment by TehesFR** [comment]
@chulkilee thanks I will test your workaround this week. Have you done this on all nodes ?

**Comment by chulkilee** [comment]
@TehesFR as far as I remember I only had to run it on worker nodes (running docker), but not sure.

**Comment by charon-kyan** [comment]
i++

**Comment by KDF5000** [comment]
@TehesFR I met the same issue. Have you found any solution ?

**Comment by tomdee** [comment]
Closing this issue from a very old version of flannel
