### ISSUE TITLE
Reachability between containers on two different hosts part of flannel network stops working after host reboot with Flannel 0.5.5 with docker version 1.12.6 on Cent OS 7.3

### ISSUE THREAD

**Issue by ganlaksh** [coreos/flannel#692]
Workaround that I do to recover from this to restart either docker or flannel and that seems to fix this issue and it always works. 

When i try to ping a container ip on the node after reboot , with tcpdump I see that the icmp packet reaches flannel0 but i dont see it being forwarded to docker0 on the host. 

[root@ip-10-0-101-186 ansible]# tcpdump -i flannel0
tcpdump: verbose output suppressed, use -v or -vv for full protocol decode
listening on flannel0, link-type RAW (Raw IP), capture size 65535 bytes
16:56:33.766764 IP ip-172-17-16-0.ec2.internal > ip-172-17-19-2.ec2.internal: ICMP echo request, id 3337, seq 7, length 64
16:56:34.766811 IP ip-172-17-16-0.ec2.internal > ip-172-17-19-2.ec2.internal: ICMP echo request, id 3337, seq 8, length 64
16:56:35.766783 IP ip-172-17-16-0.ec2.internal > ip-172-17-19-2.ec2.internal: ICMP echo request, id 3337, seq 9, length 64
16:56:36.766779 IP ip-172-17-16-0.ec2.internal > ip-172-17-19-2.ec2.internal: ICMP echo request, id 3337, seq 10, length 64
16:56:37.766759 IP ip-172-17-16-0.ec2.internal > ip-172-17-19-2.ec2.internal: ICMP echo request, id 3337, seq 11, length 64
16:56:38.766684 IP ip-172-17-16-0.ec2.internal > ip-172-17-19-2.ec2.internal: ICMP echo request, id 3337, seq 12, length 64

[root@ip-10-0-101-186 ansible]# ip route
default via 10.0.96.1 dev eth0 
10.0.96.0/20 dev eth0  proto kernel  scope link  src 10.0.101.186 
169.254.0.0/16 dev eth0  scope link  metric 1002 
172.17.0.0/16 dev flannel0  proto kernel  scope link  src 172.17.19.0 
172.17.19.0/24 dev docker0  proto kernel  scope link  src 172.17.19.1 

[root@ip-10-0-101-186 ansible]# route -n 
Kernel IP routing table
Destination     Gateway         Genmask         Flags Metric Ref    Use Iface
0.0.0.0         10.0.96.1       0.0.0.0         UG    0      0        0 eth0
10.0.96.0       0.0.0.0         255.255.240.0   U     0      0        0 eth0
169.254.0.0     0.0.0.0         255.255.0.0     U     1002   0        0 eth0
172.17.0.0      0.0.0.0         255.255.0.0     U     0      0        0 flannel0
172.17.19.0     0.0.0.0         255.255.255.0   U     0      0        0 docker0

After the reboot i notice that flannel is up only a few seconds (3 seconds before) before docker and i am wondering if this could have this impact.

**Comment by euank** [comment]
@ganlaksh can you try with flannel version 0.7.1? I think https://github.com/coreos/flannel/pull/576 might be relevant, though I'm not sure.

**Comment by ganlaksh** [comment]
@euank I am using flannel with udp and not vxlan. Do you think it could still be relevant ? I will give it a try anyway. thanks!

**Comment by ganlaksh** [comment]
@euank Tried with 0.7.1 and i see the same issue after node reboot and same workaround works as well .

**Comment by tomdee** [comment]
Talking to @ganlaksh offline and this issue is AWS only

**Comment by tomdee** [comment]
@ganlaksh Is there a reason why you're using `udp` rather than `vxlan` backend? VXLAN should have much better performance

**Comment by ganlaksh** [comment]
@tomdee We havent looked into the performance aspect yet and we were just going with the defaults as of now.

**Comment by tomdee** [comment]
`udp` is only the default since it works for some older kernels. You should be using `vxlan` unless you have a good reason not to.

**Comment by tomdee** [comment]
Hi @ganlaksh without a repro I can investigate or fix this issue. Are you still having a problem? If so let us know here and I can try to help.
