### ISSUE TITLE
Flannel ping ICMP packets not routed back properly

### ISSUE THREAD

**Issue by andrejvanderzee** [coreos/flannel#415]
Hi,

Somehow I cannot seem to ping over the flannel network (flanneld version 0.5.3). I have a virtual box guest running Ubuntu that runs on the host's private network. When I ping from the guest (10.1.58.0) to the host's docker IP on flannel with "ping 10.1.3.1" or "ping 10.1.3.0", the traffic does arrive on the host:

tcpump on the host:

```
$ sudo tcpdump -i any -n icmp
tcpdump: verbose output suppressed, use -v or -vv for full protocol decode
listening on any, link-type LINUX_SLL (Linux cooked), capture size 262144 bytes
22:59:26.252319 IP 10.1.58.0 > 10.1.3.0: ICMP echo request, id 17143, seq 10, length 64
22:59:26.252339 IP 10.1.3.0 > 10.1.58.0: ICMP echo reply, id 17143, seq 10, length 64
22:59:27.252209 IP 10.1.58.0 > 10.1.3.0: ICMP echo request, id 17143, seq 11, length 64
22:59:27.252230 IP 10.1.3.0 > 10.1.58.0: ICMP echo reply, id 17143, seq 11, length 64
... etc ...
```

But the replies do not arrive back at the guest. Routing tables of the host looks fine:

ip route at the host:

```
default via 192.168.1.1 dev wlp3s0  proto static  metric 600 
10.1.0.0/16 dev flannel.1 
10.1.3.0/24 dev docker0  proto kernel  scope link  src 10.1.3.1 
169.254.0.0/16 dev wlp3s0  scope link  metric 1000 
192.168.1.0/24 dev wlp3s0  proto kernel  scope link  src 192.168.1.11  metric 600 
192.168.33.0/24 dev vboxnet1  proto kernel  scope link  src 192.168.33.1 
```

This is ip route at the guest:

```
default via 10.0.2.2 dev eth0 
10.0.2.0/24 dev eth0  proto kernel  scope link  src 10.0.2.15 
10.1.0.0/16 dev flannel.1  proto kernel  scope link  src 10.1.58.0 
10.1.58.0/24 dev docker0  proto kernel  scope link  src 10.1.58.1 
192.168.33.0/24 dev eth1  proto kernel  scope link  src 192.168.33.66 

```

It seems like a routing problem at the host's side. I have tried to start flanneld with the option -iface=vboxnet1 (in my understanding it would force routing over the virtual box private network) but with the same results.

Any idea? Thanks.

**Comment by andrejvanderzee** [comment]
This is what systemctl status flanneld on the host has to say:

```
flanneld[6681]: I0304 08:35:52.757607 06681 vxlan.go:356] AddL3 succeeded
flanneld[6681]: I0304 08:36:32.530947 06681 vxlan.go:340] Ignoring not a miss: 4e:25:39:d7:76:68, flanneld[6681]: I0304 08:36:38.066940 06681 vxlan.go:340] Ignoring not a miss: 4e:25:39:d7:76:68, 10.1.32.0
flanneld[6681]: I0304 08:36:41.066954 06681 vxlan.go:340] Ignoring not a miss: 4e:25:39:d7:76:68, 10.1.32.0
flanneld[6681]: I0304 08:36:42.066987 06681 vxlan.go:340] Ignoring not a miss: 4e:25:39:d7:76:68, 10.1.32.0
flanneld[6681]: I0304 08:36:43.066908 06681 vxlan.go:340] Ignoring not a miss: 4e:25:39:d7:76:68, 10.1.32.0
flanneld[6681]: I0304 08:36:44.140476 06681 vxlan.go:345] L3 miss: 10.1.32.0
flanneld[6681]: I0304 08:36:44.140515 06681 device.go:187] calling NeighSet: 10.1.32.0, 4e:25:39:d7:76:68
flanneld[6681]: I0304 08:36:44.140622 06681 vxlan.go:356] AddL3 succeeded
```

**Comment by vladar** [comment]
See the same on flannel 0.5.5 on Ubuntu 14.04 OpenStack VM

**Comment by jkong85** [comment]
Is this problem fixed?

**Comment by tomdee** [comment]
Can anyone reproduce this issue with flannel 0.7.0? I can't see how this can be a flannel problem but I would like to be proved wrong. I'm going to close this issue but if anyone is still seeing this problem then please reopen.
