### ISSUE TITLE
ICMP cannot reach to docker0 interface

### ISSUE THREAD

**Issue by keontang** [coreos/flannel#469]
When I ping pod ip, flannel.1 interface can get ICMP packets, but docker0 failed.
```
root@cy04:/home/ubuntu04# ping 172.16.90.4
PING 172.16.90.4 (172.16.90.4) 56(84) bytes of data.


root@cy05:/home/ubuntu05# tcpdump -i flannel.1 icmp
tcpdump: verbose output suppressed, use -v or -vv for full protocol decode
listening on flannel.1, link-type EN10MB (Ethernet), capture size 65535 bytes
13:43:42.686451 IP 172.16.33.0 > 172.16.90.4: ICMP echo request, id 50378, seq 1, length 64
13:43:43.693904 IP 172.16.33.0 > 172.16.90.4: ICMP echo request, id 50378, seq 2, length 64
13:43:44.701943 IP 172.16.33.0 > 172.16.90.4: ICMP echo request, id 50378, seq 3, length 64
13:43:45.710000 IP 172.16.33.0 > 172.16.90.4: ICMP echo request, id 50378, seq 4, length 64
13:43:46.718643 IP 172.16.33.0 > 172.16.90.4: ICMP echo request, id 50378, seq 5, length 64
13:43:47.727064 IP 172.16.33.0 > 172.16.90.4: ICMP echo request, id 50378, seq 6, length 64
13:43:48.733968 IP 172.16.33.0 > 172.16.90.4: ICMP echo request, id 50378, seq 7, length 64
13:43:49.742132 IP 172.16.33.0 > 172.16.90.4: ICMP echo request, id 50378, seq 8, length 64
13:43:50.751567 IP 172.16.33.0 > 172.16.90.4: ICMP echo request, id 50378, seq 9, length 64
13:43:51.759821 IP 172.16.33.0 > 172.16.90.4: ICMP echo request, id 50378, seq 10, length 64
13:43:52.766572 IP 172.16.33.0 > 172.16.90.4: ICMP echo request, id 50378, seq 11, length 64
13:43:53.774798 IP 172.16.33.0 > 172.16.90.4: ICMP echo request, id 50378, seq 12, length 64
13:43:54.782508 IP 172.16.33.0 > 172.16.90.4: ICMP echo request, id 50378, seq 13, length 64
13:43:55.790234 IP 172.16.33.0 > 172.16.90.4: ICMP echo request, id 50378, seq 14, length 64
13:43:56.798800 IP 172.16.33.0 > 172.16.90.4: ICMP echo request, id 50378, seq 15, length 64
13:43:57.805943 IP 172.16.33.0 > 172.16.90.4: ICMP echo request, id 50378, seq 16, length 64
13:43:58.814044 IP 172.16.33.0 > 172.16.90.4: ICMP echo request, id 50378, seq 17, length 64
13:43:59.822207 IP 172.16.33.0 > 172.16.90.4: ICMP echo request, id 50378, seq 18, length 64
13:44:00.830045 IP 172.16.33.0 > 172.16.90.4: ICMP echo request, id 50378, seq 19, length 64
13:44:01.838102 IP 172.16.33.0 > 172.16.90.4: ICMP echo request, id 50378, seq 20, length 64
13:44:02.846024 IP 172.16.33.0 > 172.16.90.4: ICMP echo request, id 50378, seq 21, length 64


root@cy05:/home/ubuntu05# tcpdump -i docker0 icmp
tcpdump: verbose output suppressed, use -v or -vv for full protocol decode
listening on docker0, link-type EN10MB (Ethernet), capture size 65535 bytes
13:44:45.623766 IP 172.16.90.3 > 172.16.90.2: ICMP 172.16.90.3 udp port 35638 unreachable, length 164
13:44:45.623802 IP 172.16.90.3 > 172.16.90.2: ICMP 172.16.90.3 udp port 35638 unreachable, length 164
13:44:45.624038 IP 172.16.90.3 > 172.16.90.2: ICMP 172.16.90.3 udp port 43919 unreachable, length 119
13:44:45.624051 IP 172.16.90.3 > 172.16.90.2: ICMP 172.16.90.3 udp port 43919 unreachable, length 119
13:44:45.628659 IP 172.16.90.3 > 172.16.90.2: ICMP 172.16.90.3 udp port 45638 unreachable, length 164
13:44:45.628674 IP 172.16.90.3 > 172.16.90.2: ICMP 172.16.90.3 udp port 45638 unreachable, length 164
13:44:45.628927 IP 172.16.90.3 > 172.16.90.2: ICMP 172.16.90.3 udp port 48997 unreachable, length 119
13:44:45.628940 IP 172.16.90.3 > 172.16.90.2: ICMP 172.16.90.3 udp port 48997 unreachable, length 119




```

Three nodes have the same environment, ubuntu04 for k8s master, and ubuntu05, ubuntu06 for k8s node.

ubuntu04 environment:
```
root@cy04:/home/ubuntu04# cat /etc/os-release 
NAME="Ubuntu"
VERSION="14.04, Trusty Tahr"
ID=ubuntu
ID_LIKE=debian
PRETTY_NAME="Ubuntu 14.04 LTS"
VERSION_ID="14.04"
HOME_URL="http://www.ubuntu.com/"
SUPPORT_URL="http://help.ubuntu.com/"
BUG_REPORT_URL="http://bugs.launchpad.net/ubuntu/"
root@cy04:/home/ubuntu04# docker --version
Docker version 1.9.1, build a34a1d5
root@cy04:/home/ubuntu04# flanneld --version
0.5.5

root@cy04:/home/ubuntu04# ps aux |grep docker
root     38770  0.3  0.1 776372 30556 ?        Ssl  12:22   0:10 /usr/bin/docker daemon -H tcp://127.0.0.1:4243 -H unix:///var/run/docker.sock --bip 172.16.33.1/24 --mtu 1450
root     46600  0.0  0.0  15916   960 pts/4    S+   13:16   0:00 grep --color=auto docker
root@cy04:/home/ubuntu04# ps aux |grep flanneld
root     38723  0.0  0.0 142668  5220 ?        Ssl  12:22   0:00 /usr/bin/flanneld -etcd-endpoints=http://192.168.1.224:2379 -etcd-prefix=/kube-default/network -iface=eth0 -ip-masq=true
root     46602  0.0  0.0  15916   960 pts/4    S+   13:16   0:00 grep --color=auto flanneld

root@cy04:/home/ubuntu04# ip route
default via 192.168.1.254 dev eth0  proto static 
172.16.0.0/12 dev flannel.1 
172.16.33.0/24 dev docker0  proto kernel  scope link  src 172.16.33.1 
192.168.1.0/24 dev eth0  proto kernel  scope link  src 192.168.1.224  metric 1 
root@cy04:/home/ubuntu04# ip addr show
1: lo: <LOOPBACK,UP,LOWER_UP> mtu 65536 qdisc noqueue state UNKNOWN group default 
    link/loopback 00:00:00:00:00:00 brd 00:00:00:00:00:00
    inet 127.0.0.1/8 scope host lo
       valid_lft forever preferred_lft forever
    inet6 ::1/128 scope host 
       valid_lft forever preferred_lft forever
2: eth0: <BROADCAST,MULTICAST,UP,LOWER_UP> mtu 1500 qdisc pfifo_fast state UP group default qlen 1000
    link/ether 0c:da:41:1d:4f:77 brd ff:ff:ff:ff:ff:ff
    inet 192.168.1.224/24 brd 192.168.1.255 scope global eth0
       valid_lft forever preferred_lft forever
    inet6 fe80::eda:41ff:fe1d:4f77/64 scope link 
       valid_lft forever preferred_lft forever
3: flannel.1: <BROADCAST,MULTICAST,UP,LOWER_UP> mtu 1450 qdisc noqueue state UNKNOWN group default 
    link/ether 66:e8:b8:09:74:29 brd ff:ff:ff:ff:ff:ff
    inet 172.16.33.0/12 scope global flannel.1
       valid_lft forever preferred_lft forever
    inet6 fe80::64e8:b8ff:fe09:7429/64 scope link 
       valid_lft forever preferred_lft forever
4: docker0: <NO-CARRIER,BROADCAST,MULTICAST,UP> mtu 1500 qdisc noqueue state DOWN group default 
    link/ether 02:42:78:39:a2:89 brd ff:ff:ff:ff:ff:ff
    inet 172.16.33.1/24 scope global docker0
       valid_lft forever preferred_lft forever

root@cy04:/home/ubuntu04# arp -n
Address                  HWtype  HWaddress           Flags Mask            Iface
172.16.90.4              ether   02:76:af:74:f5:99   C                     flannel.1
192.168.1.254            ether   74:25:8a:63:52:22   C                     eth0
192.168.1.226            ether   0c:da:41:1d:80:0a   C                     eth0
192.168.1.225            ether   0c:da:41:1d:69:a9   C                     eth0
192.168.1.221            ether   0c:da:41:1d:09:53   C                     eth0
```

ubuntu05 environment:
```
root@cy05:/home/ubuntu05# cat /etc/os-release 
NAME="Ubuntu"
VERSION="14.04, Trusty Tahr"
ID=ubuntu
ID_LIKE=debian
PRETTY_NAME="Ubuntu 14.04 LTS"
VERSION_ID="14.04"
HOME_URL="http://www.ubuntu.com/"
SUPPORT_URL="http://help.ubuntu.com/"
BUG_REPORT_URL="http://bugs.launchpad.net/ubuntu/"
root@cy05:/home/ubuntu05# docker --version
Docker version 1.9.1, build a34a1d5
root@cy05:/home/ubuntu05# flanneld --version
0.5.5

root@cy05:/home/ubuntu05# ps aux |grep docker
root     48195  0.7  0.3 2567368 51540 ?       Ssl  12:21   0:42 /usr/bin/docker daemon -H tcp://127.0.0.1:4243 -H unix:///var/run/docker.sock --bip 172.16.90.1/24 --mtu 1450
root     60979  0.0  0.0  15916   960 pts/27   S+   13:50   0:00 grep --color=auto docker
root@cy05:/home/ubuntu05# ps aux |grep flanneld
root     48146  0.0  0.0 208204  7384 ?        Ssl  12:21   0:00 /usr/bin/flanneld -etcd-endpoints=http://192.168.1.224:2379 -etcd-prefix=/kube-default/network -iface=eth0 -ip-masq=true
root     61006  0.0  0.0  15916   960 pts/27   S+   13:51   0:00 grep --color=auto flanneld

root@cy05:/home/ubuntu05# ip route
default via 192.168.1.254 dev eth0  proto static 
172.16.0.0/12 dev flannel.1 
172.16.90.0/24 dev docker0  proto kernel  scope link  src 172.16.90.1 
192.168.1.0/24 dev eth0  proto kernel  scope link  src 192.168.1.225  metric 1 

root@cy05:/home/ubuntu05# ip addr show
1: lo: <LOOPBACK,UP,LOWER_UP> mtu 65536 qdisc noqueue state UNKNOWN group default 
    link/loopback 00:00:00:00:00:00 brd 00:00:00:00:00:00
    inet 127.0.0.1/8 scope host lo
       valid_lft forever preferred_lft forever
    inet6 ::1/128 scope host 
       valid_lft forever preferred_lft forever
2: eth0: <BROADCAST,MULTICAST,UP,LOWER_UP> mtu 1500 qdisc pfifo_fast state UP group default qlen 1000
    link/ether 0c:da:41:1d:69:a9 brd ff:ff:ff:ff:ff:ff
    inet 192.168.1.225/24 brd 192.168.1.255 scope global eth0
       valid_lft forever preferred_lft forever
    inet6 fe80::eda:41ff:fe1d:69a9/64 scope link 
       valid_lft forever preferred_lft forever
4: flannel.1: <BROADCAST,MULTICAST,UP,LOWER_UP> mtu 1450 qdisc noqueue state UNKNOWN group default 
    link/ether 02:76:af:74:f5:99 brd ff:ff:ff:ff:ff:ff
    inet 172.16.90.0/12 scope global flannel.1
       valid_lft forever preferred_lft forever
    inet6 fe80::76:afff:fe74:f599/64 scope link 
       valid_lft forever preferred_lft forever
5: docker0: <BROADCAST,MULTICAST,UP,LOWER_UP> mtu 1450 qdisc noqueue state UP group default 
    link/ether 02:42:e7:e6:b0:c4 brd ff:ff:ff:ff:ff:ff
    inet 172.16.90.1/24 scope global docker0
       valid_lft forever preferred_lft forever
    inet6 fe80::42:e7ff:fee6:b0c4/64 scope link 
       valid_lft forever preferred_lft forever
71: vethec45bd7: <BROADCAST,MULTICAST,UP,LOWER_UP> mtu 1450 qdisc noqueue master docker0 state UP group default 
    link/ether d2:65:60:d6:aa:1a brd ff:ff:ff:ff:ff:ff
    inet6 fe80::d065:60ff:fed6:aa1a/64 scope link 
       valid_lft forever preferred_lft forever
73: vethcfda377: <BROADCAST,MULTICAST,UP,LOWER_UP> mtu 1450 qdisc noqueue master docker0 state UP group default 
    link/ether 1a:ed:ce:dc:40:9d brd ff:ff:ff:ff:ff:ff
    inet6 fe80::18ed:ceff:fedc:409d/64 scope link 
       valid_lft forever preferred_lft forever
75: veth990c3f3: <BROADCAST,MULTICAST,UP,LOWER_UP> mtu 1450 qdisc noqueue master docker0 state UP group default 
    link/ether c6:2c:e5:be:ab:79 brd ff:ff:ff:ff:ff:ff
    inet6 fe80::c42c:e5ff:febe:ab79/64 scope link 
       valid_lft forever preferred_lft forever

root@cy05:/home/ubuntu05# arp -n
Address                  HWtype  HWaddress           Flags Mask            Iface
192.168.1.224            ether   0c:da:41:1d:4f:77   C                     eth0
172.16.90.3              ether   02:42:ac:10:5a:03   C                     docker0
192.168.1.221            ether   0c:da:41:1d:09:53   C                     eth0
172.16.90.2              ether   02:42:ac:10:5a:02   C                     docker0
192.168.1.226            ether   0c:da:41:1d:80:0a   C                     eth0
172.16.65.3              ether   ea:53:17:16:d4:c9   C                     flannel.1
172.16.90.4              ether   02:42:ac:10:5a:04   C                     docker0
192.168.1.254            ether   74:25:8a:63:52:22   C                     eth0
```

What's the problem?

**Comment by eyakubovich** [comment]
Your `docker0` seems to be `172.16.90.1`, not `172.16.90.4`. Is there a container running at `172.16.90.4`?

**Comment by keontang** [comment]
Yes, there is another guys touched my network. Now I used 192.168.76.1, it works perfect. Thank you!
