### ISSUE TITLE
Docker container unable to access the external network

### ISSUE THREAD

**Issue by rpatrick00** [coreos/flannel#252]
I have set up a 2 node Kubernetes cluster using flannel and it seemed that everything was working properly until I tried to use the application inside of my Docker containers.  The application is accessible using the Kubernetes Service but fails when the application needs to connect to the database.  Before installing flannel, the application was able to reach the database.

Removing the application, Kubernetes, and even my Docker image from the equation, it seems that the Docker container from any Docker image is not able to see the external network (e.g., pinging the IP address of the DNS server fails).

Here is my configuration:

/usr/lib/systemd/system/flannel.service:
[Unit]
Description=Flannel
After=etcd.service
Requires=etcd.service
[Service]
User=root
ExecStart=/scratch/flannel/bin/flanneld -iface=eth0 -subnet-file=/scratch/flannel/subnet.env
KillMode=process
Restart=always
[Install]
WantedBy=multi-user.target

/usr/lib/systemd/system/docker.service:
[Unit]
Description=Docker Application Container Engine
Documentation=http://docs.docker.com
After=flannel.service network.target
Requires=flannel.service
[Service]
Type=notify
EnvironmentFile=-/etc/sysconfig/docker
EnvironmentFile=-/etc/sysconfig/docker-storage
EnvironmentFile=-/etc/sysconfig/docker-network
EnvironmentFile=-/scratch/flannel/subnet.env
ExecStart=/usr/bin/docker -d \
          --bip=${FLANNEL_SUBNET} --mtu=${FLANNEL_MTU} \
          $OPTIONS \
          $DOCKER_STORAGE_OPTIONS \
          $DOCKER_NETWORK_OPTIONS \
          $INSECURE_REGISTRY
LimitNOFILE=1048576
LimitNPROC=1048576
LimitCORE=infinity
MountFlags=slave
[Install]
WantedBy=multi-user.target

/etc/sysconfig/docker:
# /etc/sysconfig/docker
# Modify these options if you want to change the way the docker daemon runs
OPTIONS='--selinux-enabled --group=docker'
DOCKER_CERT_PATH=/etc/docker
# Allow creation of core dumps
GOTRACEBACK=crash

 /etc/sysconfig/docker-storage:
# This file may be automatically generated by an installation program.
DOCKER_STORAGE_OPTIONS="--storage-opt dm.basesize=20G"

/etc/sysconfig/docker-network:
# /etc/sysconfig/docker-network
DOCKER_NETWORK_OPTIONS="--iptables=false -H tcp://0.0.0.0:4243 -H unix:///var/run/docker.sock"
HTTP_PROXY="http://www-proxy.us.oracle.com:80"
NO_PROXY="localhost,127.0.0.0/8,.oracle.com,.oraclecorp.com,/var/run/docker.sock"
HTTPS_PROXY="http://www-proxy.us.oracle.com:80"

systemctl status -l flannel output:
flannel.service - Flannel
   Loaded: loaded (/usr/lib/systemd/system/flannel.service; enabled)
   Active: active (running) since Thu 2015-07-16 07:38:11 PDT; 1h 28min ago
 Main PID: 27219 (flanneld)
   CGroup: /system.slice/flannel.service
           ââ27219 /scratch/flannel/bin/flanneld -iface=eth0 -subnet-file=/scratch/flannel/subnet.env

Jul 16 07:44:43 slc06ptm.us.oracle.com flanneld[27219]: go-etcd2015/07/16 07:44:43 DEBUG: get /coreos.com/network/subnets [http://127.0.0.1:2379]
Jul 16 07:44:43 slc06ptm.us.oracle.com flanneld[27219]: go-etcd2015/07/16 07:44:43 DEBUG: Connecting to etcd: attempt 1 for keys/coreos.com/network/subnets?recursive=true&wait=true
Jul 16 07:44:43 slc06ptm.us.oracle.com flanneld[27219]: go-etcd2015/07/16 07:44:43 DEBUG: send.request.to http://127.0.0.1:2379/v2/keys/coreos.com/network/subnets?recursive=true&wait=true | method GET
Jul 16 07:44:43 slc06ptm.us.oracle.com flanneld[27219]: I0716 07:44:43.556920 27219 udp.go:246] Subnet added: 192.168.55.0/24
Jul 16 07:44:43 slc06ptm.us.oracle.com flanneld[27219]: go-etcd2015/07/16 07:44:43 DEBUG: rawWatch /coreos.com/network/subnets []
Jul 16 07:44:43 slc06ptm.us.oracle.com flanneld[27219]: go-etcd2015/07/16 07:44:43 DEBUG: get /coreos.com/network/subnets [http://127.0.0.1:2379]
Jul 16 07:44:43 slc06ptm.us.oracle.com flanneld[27219]: go-etcd2015/07/16 07:44:43 DEBUG: Connecting to etcd: attempt 1 for keys/coreos.com/network/subnets?recursive=true&wait=true&waitIndex=854098
Jul 16 07:44:43 slc06ptm.us.oracle.com flanneld[27219]: go-etcd2015/07/16 07:44:43 DEBUG: send.request.to http://127.0.0.1:2379/v2/keys/coreos.com/network/subnets?recursive=true&wait=true&waitIndex=854098 | method GET
Jul 16 07:44:43 slc06ptm.us.oracle.com flanneld[27219]: go-etcd2015/07/16 07:44:43 DEBUG: recv.response.from
Jul 16 07:44:43 slc06ptm.us.oracle.com flanneld[27219]: go-etcd2015/07/16 07:44:43 DEBUG: recv.response.from

netstat -rn output:
Kernel IP routing table
Destination     Gateway         Genmask         Flags   MSS Window  irtt Iface
0.0.0.0         10.240.208.1    0.0.0.0         UG        0 0          0 eth0
10.240.208.0    0.0.0.0         255.255.248.0   U         0 0          0 eth0
169.254.0.0     0.0.0.0         255.255.0.0     U         0 0          0 eth0
192.168.0.0     0.0.0.0         255.255.0.0     U         0 0          0 flannel0
192.168.83.0    0.0.0.0         255.255.255.0   U         0 0          0 docker0

/sbin/ifconfig output:
docker0: flags=4163<UP,BROADCAST,RUNNING,MULTICAST>  mtu 1472
        inet 192.168.83.1  netmask 255.255.255.0  broadcast 0.0.0.0
        inet6 fe80::5484:7aff:fefe:9799  prefixlen 64  scopeid 0x20<link>
        ether 56:84:7a:fe:97:99  txqueuelen 0  (Ethernet)
        RX packets 6  bytes 384 (384.0 B)
        RX errors 0  dropped 0  overruns 0  frame 0
        TX packets 6  bytes 468 (468.0 B)
        TX errors 0  dropped 0 overruns 0  carrier 0  collisions 0

eth0: flags=4163<UP,BROADCAST,RUNNING,MULTICAST>  mtu 1500
        inet 10.240.212.144  netmask 255.255.248.0  broadcast 10.240.215.255
        inet6 fe80::221:f6ff:fede:fa43  prefixlen 64  scopeid 0x20<link>
        inet6 2606:b400:2010:4059:221:f6ff:fede:fa43  prefixlen 64  scopeid 0x0<global>
        ether 00:21:f6:de:fa:43  txqueuelen 1000  (Ethernet)
        RX packets 173607325  bytes 17419830891 (16.2 GiB)
        RX errors 0  dropped 0  overruns 0  frame 0
        TX packets 158107670  bytes 17446755448 (16.2 GiB)
        TX errors 0  dropped 0 overruns 0  carrier 0  collisions 0

flannel0: flags=4305<UP,POINTOPOINT,RUNNING,NOARP,MULTICAST>  mtu 1472
        inet 192.168.83.0  netmask 255.255.0.0  destination 192.168.83.0
        unspec 00-00-00-00-00-00-00-00-00-00-00-00-00-00-00-00  txqueuelen 500  (UNSPEC)
        RX packets 0  bytes 0 (0.0 B)
        RX errors 0  dropped 0  overruns 0  frame 0
        TX packets 5  bytes 420 (420.0 B)
        TX errors 0  dropped 0 overruns 0  carrier 0  collisions 0

lo: flags=73<UP,LOOPBACK,RUNNING>  mtu 65536
        inet 127.0.0.1  netmask 255.0.0.0
        inet6 ::1  prefixlen 128  scopeid 0x10<host>
        loop  txqueuelen 0  (Local Loopback)
        RX packets 88498038  bytes 14017025287 (13.0 GiB)
        RX errors 0  dropped 0  overruns 0  frame 0
        TX packets 88498038  bytes 14017025287 (13.0 GiB)
        TX errors 0  dropped 0 overruns 0  carrier 0  collisions 0

veth1853074: flags=67<UP,BROADCAST,RUNNING>  mtu 1472
        inet6 fe80::4489:a0ff:fea8:5ffe  prefixlen 64  scopeid 0x20<link>
        ether 46:89:a0:a8:5f:fe  txqueuelen 0  (Ethernet)
        RX packets 6  bytes 468 (468.0 B)
        RX errors 0  dropped 0  overruns 0  frame 0
        TX packets 12  bytes 936 (936.0 B)
        TX errors 0  dropped 0 overruns 0  carrier 0  collisions 0

Docker session:
-bash-4.2$ nslookup www.google.com
Server:         192.135.82.180
Address:        192.135.82.180#53

Non-authoritative answer:
Name:   www.google.com
Address: 74.125.30.103
Name:   www.google.com
Address: 74.125.30.106
Name:   www.google.com
Address: 74.125.30.99
Name:   www.google.com
Address: 74.125.30.104
Name:   www.google.com
Address: 74.125.30.105
Name:   www.google.com
Address: 74.125.30.147

-bash-4.2$ docker run --rm=true -i -t ubuntu
root@4684140bd75c:/# ping 74.125.30.105
PING 74.125.30.105 (74.125.30.105) 56(84) bytes of data.
^C
--- 74.125.30.105 ping statistics ---
14 packets transmitted, 0 received, 100% packet loss, time 12999ms

root@292ea90da628:/# ping 192.135.82.180
PING 192.135.82.180 (192.135.82.180) 56(84) bytes of data.
^C
--- 192.135.82.180 ping statistics ---
34 packets transmitted, 0 received, 100% packet loss, time 32999ms

root@4684140bd75c:/# ip addr
1: lo: <LOOPBACK,UP,LOWER_UP> mtu 65536 qdisc noqueue state UNKNOWN group default
    link/loopback 00:00:00:00:00:00 brd 00:00:00:00:00:00
    inet 127.0.0.1/8 scope host lo
    inet6 ::1/128 scope host
       valid_lft forever preferred_lft forever
42: eth0: <BROADCAST,UP,LOWER_UP> mtu 1472 qdisc noqueue state UP group default
    link/ether 02:42:c0:a8:53:04 brd ff:ff:ff:ff:ff:ff
    inet 192.168.83.4/24 scope global eth0
    inet6 fe80::42:c0ff:fea8:5304/64 scope link
       valid_lft forever preferred_lft forever
root@292ea90da628:/# ip route
default via 192.168.83.1 dev eth0
192.168.83.0/24 dev eth0  proto kernel  scope link  src 192.168.83.3
root@292ea90da628:/#

I am at a loss for what is wrong.  Any help would be greatly appreciated!

Thanks,
Robert

**Comment by eyakubovich** [comment]
Your `DOCKER_NETWORK_OPTIONS="--iptables=false` disables iptables including masquerade (NAT). That's actually good but you need to then pass `--ip-masq` to flanneld. This way flannel will install IP masquerade rule that will NAT traffic going outside of its network.

Also make sure `sysctl net.ipv4.ip_forward` returns 1. Docker will usually enable it but might not if --iptables=false is passed in.

**Comment by rpatrick00** [comment]
Thanks so much, that resolved my issue!

**Comment by rpatrick00** [comment]
Sorry, one more twist to the problem.  Adding the --ip-masq flag to the flanneld command line resolved the issue with accessing external addresses.  I can now see external (non-flannel) IP addresses from inside my Docker containers.  However, I am still not able to see other Docker containers running on different hosts.

On host1:
-bash-4.2$ hostname
slc06ptm.us.oracle.com
-bash-4.2$ docker ps
CONTAINER ID        IMAGE               COMMAND             CREATED             STATUS              PORTS               NAMES
65b9e54d3da5        ubuntu:14.04        "/bin/bash"         9 seconds ago       Up 8 seconds                            silly_nobel
-bash-4.2$ docker inspect 65b9e54d3da5 | grep IPA
        "IPAddress": "192.168.83.8",
-bash-4.2$ ping 192.168.83.8
PING 192.168.83.8 (192.168.83.8) 56(84) bytes of data.
64 bytes from 192.168.83.8: icmp_seq=1 ttl=64 time=0.070 ms
64 bytes from 192.168.83.8: icmp_seq=2 ttl=64 time=0.045 ms
64 bytes from 192.168.83.8: icmp_seq=3 ttl=64 time=0.052 ms

--- 192.168.83.8 ping statistics ---
3 packets transmitted, 3 received, 0% packet loss, time 1999ms
rtt min/avg/max/mdev = 0.045/0.055/0.070/0.013 ms
-bash-4.2$

On host2:
-bash-4.2$ hostname
slc07jey.us.oracle.com
-bash-4.2$ docker ps
CONTAINER ID        IMAGE               COMMAND             CREATED             STATUS              PORTS               NAMES
c08c68c475ec        ubuntu:14.04        "/bin/bash"         12 seconds ago      Up 11 seconds                           sick_einstein
-bash-4.2$ docker inspect c08c68c475ec | grep IPA
        "IPAddress": "192.168.55.4",
-bash-4.2$ ping 192.168.55.4
PING 192.168.55.4 (192.168.55.4) 56(84) bytes of data.
64 bytes from 192.168.55.4: icmp_seq=1 ttl=64 time=0.091 ms
64 bytes from 192.168.55.4: icmp_seq=2 ttl=64 time=0.037 ms
64 bytes from 192.168.55.4: icmp_seq=3 ttl=64 time=0.042 ms

--- 192.168.55.4 ping statistics ---
3 packets transmitted, 3 received, 0% packet loss, time 2000ms
rtt min/avg/max/mdev = 0.037/0.056/0.091/0.025 ms
-bash-4.2$

Inside Docker container on host1:
-bash-4.2$ docker run --rm=true -it ubuntu:14.04
root@65b9e54d3da5:/# ping 192.135.82.180
PING 192.135.82.180 (192.135.82.180) 56(84) bytes of data.
64 bytes from 192.135.82.180: icmp_seq=1 ttl=60 time=0.385 ms
64 bytes from 192.135.82.180: icmp_seq=2 ttl=60 time=0.370 ms
64 bytes from 192.135.82.180: icmp_seq=3 ttl=60 time=0.426 ms
^C
--- 192.135.82.180 ping statistics ---
3 packets transmitted, 3 received, 0% packet loss, time 2000ms
rtt min/avg/max/mdev = 0.370/0.393/0.426/0.032 ms
root@65b9e54d3da5:/# ping 192.168.83.8
PING 192.168.83.8 (192.168.83.8) 56(84) bytes of data.
64 bytes from 192.168.83.8: icmp_seq=1 ttl=64 time=0.040 ms
64 bytes from 192.168.83.8: icmp_seq=2 ttl=64 time=0.026 ms
64 bytes from 192.168.83.8: icmp_seq=3 ttl=64 time=0.025 ms
^C
--- 192.168.83.8 ping statistics ---
3 packets transmitted, 3 received, 0% packet loss, time 1999ms
rtt min/avg/max/mdev = 0.025/0.030/0.040/0.008 ms
root@65b9e54d3da5:/# ping 192.168.55.4
PING 192.168.55.4 (192.168.55.4) 56(84) bytes of data.
^C
--- 192.168.55.4 ping statistics ---
5 packets transmitted, 0 received, 100% packet loss, time 3999ms

Inside Docker container on host2:
-bash-4.2$ docker run --rm=true -it ubuntu:14.04
root@c08c68c475ec:/# ping 192.135.82.180
PING 192.135.82.180 (192.135.82.180) 56(84) bytes of data.
64 bytes from 192.135.82.180: icmp_seq=1 ttl=60 time=0.376 ms
64 bytes from 192.135.82.180: icmp_seq=2 ttl=60 time=0.329 ms
64 bytes from 192.135.82.180: icmp_seq=3 ttl=60 time=0.412 ms
^C
--- 192.135.82.180 ping statistics ---
3 packets transmitted, 3 received, 0% packet loss, time 1999ms
rtt min/avg/max/mdev = 0.329/0.372/0.412/0.037 ms
root@c08c68c475ec:/# ping 192.168.55.4
PING 192.168.55.4 (192.168.55.4) 56(84) bytes of data.
64 bytes from 192.168.55.4: icmp_seq=1 ttl=64 time=0.028 ms
64 bytes from 192.168.55.4: icmp_seq=2 ttl=64 time=0.054 ms
64 bytes from 192.168.55.4: icmp_seq=3 ttl=64 time=0.048 ms
^C
--- 192.168.55.4 ping statistics ---
3 packets transmitted, 3 received, 0% packet loss, time 1999ms
rtt min/avg/max/mdev = 0.028/0.043/0.054/0.012 ms
root@c08c68c475ec:/# ping 192.168.83.8
PING 192.168.83.8 (192.168.83.8) 56(84) bytes of data.
^C
--- 192.168.83.8 ping statistics ---
3 packets transmitted, 0 received, 100% packet loss, time 1999ms

As you can see, from inside the container I can ping external (non-flannel) IP addresses and the flannel IP on the same machine but I am unable to ping the flannel IP on the other machine.  Any additional insight on how to make this work would be greatly appreciated!

Thanks again,
Robert

**Comment by eyakubovich** [comment]
@rpatrick00 Please make sure you don't have firewall blocking traffic: https://github.com/coreos/flannel#firewalls

If you're in a cloud environment, make sure your security groups allow the UDP traffic on the proper ports.

**Comment by rpatrick00** [comment]
I am not in a public cloud environment and the UDP ports seem to be working at the host level:

Host1:
-bash-4.2$ sudo systemctl stop docker
-bash-4.2$ sudo systemctl stop flannel
-bash-4.2$ nc -l -u 8285
Hello it's me
^C
-bash-4.2$ echo "Well hello me" > source_file
-bash-4.2$ nc -u slc07jey.us.oracle.com 8285 < source_file


Host2:
-bash-4.2$ sudo systemctl stop docker
-bash-4.2$ sudo systemctl stop flannel
-bash-4.2$ echo "Hello it's me" > source_file
-bash-4.2$ nc -u slc06ptm.us.oracle.com 8285 < source_file
-bash-4.2$ nc -l -u 8285
Well hello me
^C
-bash-4.2$

**Comment by eyakubovich** [comment]
Keep pinging one container from another container (like you did) and then run tcpdump. First on source host's `docker0`, `flannel0`, ethernet interface and then do the same on the destination host. When dumping `docker0` and `flannel0`, look for ICMP (e.g `tcpdump -i docker0 icmp`), when doing the ethernet interface, filter for udp (`tcpdump -i eth0 udp port 8285`).

**Comment by rpatrick00** [comment]
On the source machine (host1), I see the outbound traffic being sent to the target machine (host2) but I do not see any reply traffic.  On the target machine, I see the ICMP request and reply on both docker0 and flannel0 but I see only see the inbound requests and no evidence (unless I am reading the tcpdump output wrong) of the reply being sent with eth0.

Source machine:
-bash-4.2$ hostname
slc06ptm.us.oracle.com
-bash-4.2$ sudo /sbin/tcpdump -i docker0 icmp
tcpdump: verbose output suppressed, use -v or -vv for full protocol decode
listening on docker0, link-type EN10MB (Ethernet), capture size 65535 bytes
07:40:55.083410 IP 192.168.83.2 > 192.168.55.2: ICMP echo request, id 16, seq 47, length 64
07:40:56.083395 IP 192.168.83.2 > 192.168.55.2: ICMP echo request, id 16, seq 48, length 64
07:40:57.083421 IP 192.168.83.2 > 192.168.55.2: ICMP echo request, id 16, seq 49, length 64
07:40:58.083415 IP 192.168.83.2 > 192.168.55.2: ICMP echo request, id 16, seq 50, length 64
07:40:59.083392 IP 192.168.83.2 > 192.168.55.2: ICMP echo request, id 16, seq 51, length 64
07:41:00.083382 IP 192.168.83.2 > 192.168.55.2: ICMP echo request, id 16, seq 52, length 64
07:41:01.083403 IP 192.168.83.2 > 192.168.55.2: ICMP echo request, id 16, seq 53, length 64
07:41:02.083412 IP 192.168.83.2 > 192.168.55.2: ICMP echo request, id 16, seq 54, length 64

8 packets captured
8 packets received by filter
0 packets dropped by kernel
-bash-4.2$ sudo /sbin/tcpdump -i flannel0 icmp
tcpdump: verbose output suppressed, use -v or -vv for full protocol decode
listening on flannel0, link-type RAW (Raw IP), capture size 65535 bytes
07:41:13.083410 IP 192.168.83.2 > 192.168.55.2: ICMP echo request, id 16, seq 65, length 64
07:41:14.083435 IP 192.168.83.2 > 192.168.55.2: ICMP echo request, id 16, seq 66, length 64
07:41:15.083454 IP 192.168.83.2 > 192.168.55.2: ICMP echo request, id 16, seq 67, length 64
07:41:16.083471 IP 192.168.83.2 > 192.168.55.2: ICMP echo request, id 16, seq 68, length 64
07:41:17.083463 IP 192.168.83.2 > 192.168.55.2: ICMP echo request, id 16, seq 69, length 64
07:41:18.083440 IP 192.168.83.2 > 192.168.55.2: ICMP echo request, id 16, seq 70, length 64
07:41:19.083447 IP 192.168.83.2 > 192.168.55.2: ICMP echo request, id 16, seq 71, length 64
07:41:20.083420 IP 192.168.83.2 > 192.168.55.2: ICMP echo request, id 16, seq 72, length 64
07:41:21.083439 IP 192.168.83.2 > 192.168.55.2: ICMP echo request, id 16, seq 73, length 64
07:41:22.083440 IP 192.168.83.2 > 192.168.55.2: ICMP echo request, id 16, seq 74, length 64

10 packets captured
11 packets received by filter
0 packets dropped by kernel
-bash-4.2$ sudo /sbin/tcpdump -i eth0 udp port 8285
tcpdump: verbose output suppressed, use -v or -vv for full protocol decode
listening on eth0, link-type EN10MB (Ethernet), capture size 65535 bytes
07:41:40.083439 IP slc06ptm.us.oracle.com.8285 > slc07jey.us.oracle.com.8285: UDP, length 84
07:41:41.083445 IP slc06ptm.us.oracle.com.8285 > slc07jey.us.oracle.com.8285: UDP, length 84
07:41:42.083464 IP slc06ptm.us.oracle.com.8285 > slc07jey.us.oracle.com.8285: UDP, length 84
07:41:43.083429 IP slc06ptm.us.oracle.com.8285 > slc07jey.us.oracle.com.8285: UDP, length 84
07:41:44.083422 IP slc06ptm.us.oracle.com.8285 > slc07jey.us.oracle.com.8285: UDP, length 84
07:41:45.083487 IP slc06ptm.us.oracle.com.8285 > slc07jey.us.oracle.com.8285: UDP, length 84
07:41:46.083475 IP slc06ptm.us.oracle.com.8285 > slc07jey.us.oracle.com.8285: UDP, length 84
07:41:47.083494 IP slc06ptm.us.oracle.com.8285 > slc07jey.us.oracle.com.8285: UDP, length 84
07:41:48.083462 IP slc06ptm.us.oracle.com.8285 > slc07jey.us.oracle.com.8285: UDP, length 84
07:41:49.083462 IP slc06ptm.us.oracle.com.8285 > slc07jey.us.oracle.com.8285: UDP, length 84
07:41:50.083449 IP slc06ptm.us.oracle.com.8285 > slc07jey.us.oracle.com.8285: UDP, length 84
07:41:51.083501 IP slc06ptm.us.oracle.com.8285 > slc07jey.us.oracle.com.8285: UDP, length 84

12 packets captured
13 packets received by filter
0 packets dropped by kernel
-bash-4.2$


On the target machine:
-bash-4.2$ hostname
slc07jey.us.oracle.com
-bash-4.2$ sudo /sbin/tcpdump -i eth0 udp port 8285
tcpdump: verbose output suppressed, use -v or -vv for full protocol decode
listening on eth0, link-type EN10MB (Ethernet), capture size 65535 bytes
07:43:20.081152 IP slc06ptm.us.oracle.com.8285 > slc07jey.us.oracle.com.8285: UDP, length 84
07:43:21.081249 IP slc06ptm.us.oracle.com.8285 > slc07jey.us.oracle.com.8285: UDP, length 84
07:43:22.081264 IP slc06ptm.us.oracle.com.8285 > slc07jey.us.oracle.com.8285: UDP, length 84
07:43:23.081217 IP slc06ptm.us.oracle.com.8285 > slc07jey.us.oracle.com.8285: UDP, length 84
07:43:24.081295 IP slc06ptm.us.oracle.com.8285 > slc07jey.us.oracle.com.8285: UDP, length 84
07:43:25.081235 IP slc06ptm.us.oracle.com.8285 > slc07jey.us.oracle.com.8285: UDP, length 84
07:43:26.081168 IP slc06ptm.us.oracle.com.8285 > slc07jey.us.oracle.com.8285: UDP, length 84
07:43:27.081137 IP slc06ptm.us.oracle.com.8285 > slc07jey.us.oracle.com.8285: UDP, length 84
07:43:28.081235 IP slc06ptm.us.oracle.com.8285 > slc07jey.us.oracle.com.8285: UDP, length 84
07:43:29.081183 IP slc06ptm.us.oracle.com.8285 > slc07jey.us.oracle.com.8285: UDP, length 84
07:43:30.081261 IP slc06ptm.us.oracle.com.8285 > slc07jey.us.oracle.com.8285: UDP, length 84
07:43:31.081260 IP slc06ptm.us.oracle.com.8285 > slc07jey.us.oracle.com.8285: UDP, length 84

12 packets captured
13 packets received by filter
0 packets dropped by kernel
-bash-4.2$ sudo /sbin/tcpdump -i flannel0 icmp
tcpdump: verbose output suppressed, use -v or -vv for full protocol decode
listening on flannel0, link-type RAW (Raw IP), capture size 65535 bytes
07:43:41.081217 IP 192.168.83.2 > 192.168.55.2: ICMP echo request, id 16, seq 213, length 64
07:43:41.081265 IP 192.168.55.2 > 192.168.83.2: ICMP echo reply, id 16, seq 213, length 64
07:43:42.081313 IP 192.168.83.2 > 192.168.55.2: ICMP echo request, id 16, seq 214, length 64
07:43:42.081357 IP 192.168.55.2 > 192.168.83.2: ICMP echo reply, id 16, seq 214, length 64
07:43:43.081329 IP 192.168.83.2 > 192.168.55.2: ICMP echo request, id 16, seq 215, length 64
07:43:43.081382 IP 192.168.55.2 > 192.168.83.2: ICMP echo reply, id 16, seq 215, length 64
07:43:44.081228 IP 192.168.83.2 > 192.168.55.2: ICMP echo request, id 16, seq 216, length 64
07:43:44.081278 IP 192.168.55.2 > 192.168.83.2: ICMP echo reply, id 16, seq 216, length 64
07:43:45.081300 IP 192.168.83.2 > 192.168.55.2: ICMP echo request, id 16, seq 217, length 64
07:43:45.081342 IP 192.168.55.2 > 192.168.83.2: ICMP echo reply, id 16, seq 217, length 64
07:43:46.081260 IP 192.168.83.2 > 192.168.55.2: ICMP echo request, id 16, seq 218, length 64
07:43:46.081302 IP 192.168.55.2 > 192.168.83.2: ICMP echo reply, id 16, seq 218, length 64
07:43:47.081259 IP 192.168.83.2 > 192.168.55.2: ICMP echo request, id 16, seq 219, length 64
07:43:47.081294 IP 192.168.55.2 > 192.168.83.2: ICMP echo reply, id 16, seq 219, length 64
07:43:48.081324 IP 192.168.83.2 > 192.168.55.2: ICMP echo request, id 16, seq 220, length 64
07:43:48.081373 IP 192.168.55.2 > 192.168.83.2: ICMP echo reply, id 16, seq 220, length 64

16 packets captured
18 packets received by filter
0 packets dropped by kernel
-bash-4.2$ sudo /sbin/tcpdump -i docker0 icmp
tcpdump: verbose output suppressed, use -v or -vv for full protocol decode
listening on docker0, link-type EN10MB (Ethernet), capture size 65535 bytes
07:43:59.081256 IP 192.168.83.2 > 192.168.55.2: ICMP echo request, id 16, seq 231, length 64
07:43:59.081274 IP 192.168.55.2 > 192.168.83.2: ICMP echo reply, id 16, seq 231, length 64
07:44:00.081338 IP 192.168.83.2 > 192.168.55.2: ICMP echo request, id 16, seq 232, length 64
07:44:00.081364 IP 192.168.55.2 > 192.168.83.2: ICMP echo reply, id 16, seq 232, length 64
07:44:01.081323 IP 192.168.83.2 > 192.168.55.2: ICMP echo request, id 16, seq 233, length 64
07:44:01.081340 IP 192.168.55.2 > 192.168.83.2: ICMP echo reply, id 16, seq 233, length 64
07:44:02.081312 IP 192.168.83.2 > 192.168.55.2: ICMP echo request, id 16, seq 234, length 64
07:44:02.081331 IP 192.168.55.2 > 192.168.83.2: ICMP echo reply, id 16, seq 234, length 64
07:44:03.081314 IP 192.168.83.2 > 192.168.55.2: ICMP echo request, id 16, seq 235, length 64
07:44:03.081343 IP 192.168.55.2 > 192.168.83.2: ICMP echo reply, id 16, seq 235, length 64
07:44:04.081285 IP 192.168.83.2 > 192.168.55.2: ICMP echo request, id 16, seq 236, length 64
07:44:04.081303 IP 192.168.55.2 > 192.168.83.2: ICMP echo reply, id 16, seq 236, length 64
07:44:05.081277 IP 192.168.83.2 > 192.168.55.2: ICMP echo request, id 16, seq 237, length 64
07:44:05.081297 IP 192.168.55.2 > 192.168.83.2: ICMP echo reply, id 16, seq 237, length 64

14 packets captured
16 packets received by filter
0 packets dropped by kernel
-bash-4.2$

**Comment by rpatrick00** [comment]
Reversing the direction of the ping proves there is a communication breakdown between flannel0 and eth0 on host2.  I see no traffic on host1 at all.

-bash-4.2$ hostname
slc07jey.us.oracle.com
-bash-4.2$ sudo /sbin/tcpdump -i docker0 icmp
tcpdump: verbose output suppressed, use -v or -vv for full protocol decode
listening on docker0, link-type EN10MB (Ethernet), capture size 65535 bytes
07:51:33.147186 IP 192.168.55.2 > 192.168.83.2: ICMP echo request, id 15, seq 212, length 64
07:51:34.147172 IP 192.168.55.2 > 192.168.83.2: ICMP echo request, id 15, seq 213, length 64
07:51:35.147177 IP 192.168.55.2 > 192.168.83.2: ICMP echo request, id 15, seq 214, length 64
07:51:36.147163 IP 192.168.55.2 > 192.168.83.2: ICMP echo request, id 15, seq 215, length 64
07:51:37.147206 IP 192.168.55.2 > 192.168.83.2: ICMP echo request, id 15, seq 216, length 64
07:51:38.147184 IP 192.168.55.2 > 192.168.83.2: ICMP echo request, id 15, seq 217, length 64
07:51:39.147196 IP 192.168.55.2 > 192.168.83.2: ICMP echo request, id 15, seq 218, length 64

7 packets captured
7 packets received by filter
0 packets dropped by kernel
-bash-4.2$ sudo /sbin/tcpdump -i flannel0 icmp
tcpdump: verbose output suppressed, use -v or -vv for full protocol decode
listening on flannel0, link-type RAW (Raw IP), capture size 65535 bytes
07:51:45.147165 IP 192.168.55.2 > 192.168.83.2: ICMP echo request, id 15, seq 224, length 64
07:51:46.147199 IP 192.168.55.2 > 192.168.83.2: ICMP echo request, id 15, seq 225, length 64
07:51:47.147191 IP 192.168.55.2 > 192.168.83.2: ICMP echo request, id 15, seq 226, length 64
07:51:48.147161 IP 192.168.55.2 > 192.168.83.2: ICMP echo request, id 15, seq 227, length 64
07:51:49.147174 IP 192.168.55.2 > 192.168.83.2: ICMP echo request, id 15, seq 228, length 64
07:51:50.147206 IP 192.168.55.2 > 192.168.83.2: ICMP echo request, id 15, seq 229, length 64
07:51:51.147187 IP 192.168.55.2 > 192.168.83.2: ICMP echo request, id 15, seq 230, length 64
07:51:52.147249 IP 192.168.55.2 > 192.168.83.2: ICMP echo request, id 15, seq 231, length 64

8 packets captured
8 packets received by filter
0 packets dropped by kernel
-bash-4.2$ sudo /sbin/tcpdump -i eth0 udp port 8285
tcpdump: verbose output suppressed, use -v or -vv for full protocol decode
listening on eth0, link-type EN10MB (Ethernet), capture size 65535 bytes

0 packets captured
0 packets received by filter
0 packets dropped by kernel
-bash-4.2$

How do I go about determine what is causing this breakdown?

**Comment by rpatrick00** [comment]
I have looked at the output of ifconfig, route, and the flanneld configuration and everything looks the same (other than expected IP address variations).  However, when I look at rthe output of sysconfig -a, I see differences that may be relevant (not sure).  On host1 that seems to be working, I see a bunch of flannel0 and docker0 parameters set--none of which exist on host2 (the one that is not working).  Note sure why this is...

On host1:
-bash-4.2$ hostname
slc06ptm.us.oracle.com
-bash-4.2$ sudo /sbin/sysctl -a | grep flannel
net.ipv4.conf.flannel0.accept_local = 0
net.ipv4.conf.flannel0.accept_redirects = 1
net.ipv4.conf.flannel0.accept_source_route = 0
net.ipv4.conf.flannel0.arp_accept = 0
net.ipv4.conf.flannel0.arp_announce = 0
net.ipv4.conf.flannel0.arp_filter = 0
net.ipv4.conf.flannel0.arp_ignore = 0
net.ipv4.conf.flannel0.arp_notify = 0
net.ipv4.conf.flannel0.bootp_relay = 0
net.ipv4.conf.flannel0.disable_policy = 0
net.ipv4.conf.flannel0.disable_xfrm = 0
net.ipv4.conf.flannel0.force_igmp_version = 0
net.ipv4.conf.flannel0.forwarding = 1
net.ipv4.conf.flannel0.log_martians = 0
net.ipv4.conf.flannel0.mc_forwarding = 0
net.ipv4.conf.flannel0.medium_id = 0
net.ipv4.conf.flannel0.promote_secondaries = 0
net.ipv4.conf.flannel0.proxy_arp = 0
net.ipv4.conf.flannel0.proxy_arp_pvlan = 0
net.ipv4.conf.flannel0.route_localnet = 0
net.ipv4.conf.flannel0.rp_filter = 1
net.ipv4.conf.flannel0.secure_redirects = 1
net.ipv4.conf.flannel0.send_redirects = 1
net.ipv4.conf.flannel0.shared_media = 1
net.ipv4.conf.flannel0.src_valid_mark = 0
net.ipv4.conf.flannel0.tag = 0
net.ipv4.neigh.flannel0.anycast_delay = 100
net.ipv4.neigh.flannel0.app_solicit = 0
net.ipv4.neigh.flannel0.base_reachable_time_ms = 30000
net.ipv4.neigh.flannel0.delay_first_probe_time = 5
net.ipv4.neigh.flannel0.gc_stale_time = 60
net.ipv4.neigh.flannel0.locktime = 100
net.ipv4.neigh.flannel0.mcast_solicit = 3
net.ipv4.neigh.flannel0.proxy_delay = 80
net.ipv4.neigh.flannel0.proxy_qlen = 64
net.ipv4.neigh.flannel0.retrans_time_ms = 1000
net.ipv4.neigh.flannel0.ucast_solicit = 3
net.ipv4.neigh.flannel0.unres_qlen = 31
net.ipv4.neigh.flannel0.unres_qlen_bytes = 65536
net.ipv6.conf.flannel0.accept_dad = -1
net.ipv6.conf.flannel0.accept_ra = 1
net.ipv6.conf.flannel0.accept_ra_defrtr = 1
net.ipv6.conf.flannel0.accept_ra_pinfo = 1
net.ipv6.conf.flannel0.accept_ra_rt_info_max_plen = 0
net.ipv6.conf.flannel0.accept_ra_rtr_pref = 1
net.ipv6.conf.flannel0.accept_redirects = 1
net.ipv6.conf.flannel0.accept_source_route = 0
net.ipv6.conf.flannel0.autoconf = 1
net.ipv6.conf.flannel0.dad_transmits = 1
net.ipv6.conf.flannel0.disable_ipv6 = 0
net.ipv6.conf.flannel0.force_mld_version = 0
net.ipv6.conf.flannel0.force_tllao = 0
net.ipv6.conf.flannel0.forwarding = 0
net.ipv6.conf.flannel0.hop_limit = 64
net.ipv6.conf.flannel0.max_addresses = 16
net.ipv6.conf.flannel0.max_desync_factor = 600
net.ipv6.conf.flannel0.mc_forwarding = 0
net.ipv6.conf.flannel0.mtu = 1472
net.ipv6.conf.flannel0.ndisc_notify = 0
net.ipv6.conf.flannel0.optimistic_dad = 0
net.ipv6.conf.flannel0.proxy_ndp = 0
net.ipv6.conf.flannel0.regen_max_retry = 3
net.ipv6.conf.flannel0.router_probe_interval = 60
net.ipv6.conf.flannel0.router_solicitation_delay = 1
net.ipv6.conf.flannel0.router_solicitation_interval = 4
net.ipv6.conf.flannel0.router_solicitations = 3
net.ipv6.conf.flannel0.temp_prefered_lft = 86400
net.ipv6.conf.flannel0.temp_valid_lft = 604800
net.ipv6.conf.flannel0.use_tempaddr = -1
net.ipv6.neigh.flannel0.anycast_delay = 100
net.ipv6.neigh.flannel0.app_solicit = 0
net.ipv6.neigh.flannel0.base_reachable_time_ms = 30000
net.ipv6.neigh.flannel0.delay_first_probe_time = 5
net.ipv6.neigh.flannel0.gc_stale_time = 60
net.ipv6.neigh.flannel0.locktime = 0
net.ipv6.neigh.flannel0.mcast_solicit = 3
net.ipv6.neigh.flannel0.proxy_delay = 80
net.ipv6.neigh.flannel0.proxy_qlen = 64
net.ipv6.neigh.flannel0.retrans_time_ms = 1000
net.ipv6.neigh.flannel0.ucast_solicit = 3
net.ipv6.neigh.flannel0.unres_qlen = 31
net.ipv6.neigh.flannel0.unres_qlen_bytes = 65536
-bash-4.2$ sudo /sbin/sysctl -a | grep docker
net.ipv4.conf.docker0.accept_local = 0
net.ipv4.conf.docker0.accept_redirects = 1
net.ipv4.conf.docker0.accept_source_route = 0
net.ipv4.conf.docker0.arp_accept = 0
net.ipv4.conf.docker0.arp_announce = 0
net.ipv4.conf.docker0.arp_filter = 0
net.ipv4.conf.docker0.arp_ignore = 0
net.ipv4.conf.docker0.arp_notify = 0
net.ipv4.conf.docker0.bootp_relay = 0
net.ipv4.conf.docker0.disable_policy = 0
net.ipv4.conf.docker0.disable_xfrm = 0
net.ipv4.conf.docker0.force_igmp_version = 0
net.ipv4.conf.docker0.forwarding = 1
net.ipv4.conf.docker0.log_martians = 0
net.ipv4.conf.docker0.mc_forwarding = 0
net.ipv4.conf.docker0.medium_id = 0
net.ipv4.conf.docker0.promote_secondaries = 0
net.ipv4.conf.docker0.proxy_arp = 0
net.ipv4.conf.docker0.proxy_arp_pvlan = 0
net.ipv4.conf.docker0.route_localnet = 0
net.ipv4.conf.docker0.rp_filter = 1
net.ipv4.conf.docker0.secure_redirects = 1
net.ipv4.conf.docker0.send_redirects = 1
net.ipv4.conf.docker0.shared_media = 1
net.ipv4.conf.docker0.src_valid_mark = 0
net.ipv4.conf.docker0.tag = 0
net.ipv4.neigh.docker0.anycast_delay = 100
net.ipv4.neigh.docker0.app_solicit = 0
net.ipv4.neigh.docker0.base_reachable_time_ms = 30000
net.ipv4.neigh.docker0.delay_first_probe_time = 5
net.ipv4.neigh.docker0.gc_stale_time = 60
net.ipv4.neigh.docker0.locktime = 100
net.ipv4.neigh.docker0.mcast_solicit = 3
net.ipv4.neigh.docker0.proxy_delay = 80
net.ipv4.neigh.docker0.proxy_qlen = 64
net.ipv4.neigh.docker0.retrans_time_ms = 1000
net.ipv4.neigh.docker0.ucast_solicit = 3
net.ipv4.neigh.docker0.unres_qlen = 31
net.ipv4.neigh.docker0.unres_qlen_bytes = 65536
net.ipv6.conf.docker0.accept_dad = 1
net.ipv6.conf.docker0.accept_ra = 1
net.ipv6.conf.docker0.accept_ra_defrtr = 1
net.ipv6.conf.docker0.accept_ra_pinfo = 1
net.ipv6.conf.docker0.accept_ra_rt_info_max_plen = 0
net.ipv6.conf.docker0.accept_ra_rtr_pref = 1
net.ipv6.conf.docker0.accept_redirects = 1
net.ipv6.conf.docker0.accept_source_route = 0
net.ipv6.conf.docker0.autoconf = 1
net.ipv6.conf.docker0.dad_transmits = 1
net.ipv6.conf.docker0.disable_ipv6 = 0
net.ipv6.conf.docker0.force_mld_version = 0
net.ipv6.conf.docker0.force_tllao = 0
net.ipv6.conf.docker0.forwarding = 0
net.ipv6.conf.docker0.hop_limit = 64
net.ipv6.conf.docker0.max_addresses = 16
net.ipv6.conf.docker0.max_desync_factor = 600
net.ipv6.conf.docker0.mc_forwarding = 0
net.ipv6.conf.docker0.mtu = 1472
net.ipv6.conf.docker0.ndisc_notify = 0
net.ipv6.conf.docker0.optimistic_dad = 0
net.ipv6.conf.docker0.proxy_ndp = 0
net.ipv6.conf.docker0.regen_max_retry = 3
net.ipv6.conf.docker0.router_probe_interval = 60
net.ipv6.conf.docker0.router_solicitation_delay = 1
net.ipv6.conf.docker0.router_solicitation_interval = 4
net.ipv6.conf.docker0.router_solicitations = 3
net.ipv6.conf.docker0.temp_prefered_lft = 86400
net.ipv6.conf.docker0.temp_valid_lft = 604800
net.ipv6.conf.docker0.use_tempaddr = 0
net.ipv6.neigh.docker0.anycast_delay = 100
net.ipv6.neigh.docker0.app_solicit = 0
net.ipv6.neigh.docker0.base_reachable_time_ms = 30000
net.ipv6.neigh.docker0.delay_first_probe_time = 5
net.ipv6.neigh.docker0.gc_stale_time = 60
net.ipv6.neigh.docker0.locktime = 0
net.ipv6.neigh.docker0.mcast_solicit = 3
net.ipv6.neigh.docker0.proxy_delay = 80
net.ipv6.neigh.docker0.proxy_qlen = 64
net.ipv6.neigh.docker0.retrans_time_ms = 1000
net.ipv6.neigh.docker0.ucast_solicit = 3
net.ipv6.neigh.docker0.unres_qlen = 31
net.ipv6.neigh.docker0.unres_qlen_bytes = 65536
-bash-4.2$


On host2:
-bash-4.2$ hostname
slc07jey.us.oracle.com
-bash-4.2$ sudo /sbin/sysctl -a | grep flannel
-bash-4.2$ sudo /sbin/sysctl -a | grep docker
-bash-4.2$


Is this important?  How did those get created on host1 (I didn't do it)?  If these are important, how do I create them on host2 (other than by brute force)?

**Comment by eyakubovich** [comment]
@rpatrick00 Can you paste the output of `ip addr show` and `iptables -L -n` from the target (bad) host? Another thing to try is to `tcpdump -i eth0 arp` to see if it least the ARP requests go out. That will also show, if for reason, it's trying to send the traffic to the wrong IP.

Also, what distro are you running?

**Comment by rpatrick00** [comment]
I am running on Oracle Enterprise Linux (which is based on RedHat):

-bash-4.2$ uname -a
Linux slc07jey.us.oracle.com 3.8.13-35.3.1.el7uek.x86_64 #2 SMP Wed Jun 25 15:27:43 PDT 2014 x86_64 x86_64 x86_64 GNU/Linux
-bash-4.2$ /scratch/flannel/bin/flanneld -version
0.4.1+git

Here is the output you requested.  The arp messages do not seem to be related to the ping...

On host2:
-bash-4.2$ /sbin/ip addr show
1: lo: <LOOPBACK,UP,LOWER_UP> mtu 65536 qdisc noqueue state UNKNOWN
    link/loopback 00:00:00:00:00:00 brd 00:00:00:00:00:00
    inet 127.0.0.1/8 scope host lo
    inet6 ::1/128 scope host
       valid_lft forever preferred_lft forever
2: eth0: <BROADCAST,MULTICAST,UP,LOWER_UP> mtu 1500 qdisc pfifo_fast state UP qlen 1000
    link/ether 00:21:f6:2c:0d:c8 brd ff:ff:ff:ff:ff:ff
    inet 10.240.182.228/21 brd 10.240.183.255 scope global eth0
    inet6 2606:b400:2010:4055:221:f6ff:fe2c:dc8/64 scope global dynamic
       valid_lft 2591844sec preferred_lft 604644sec
    inet6 fe80::221:f6ff:fe2c:dc8/64 scope link
       valid_lft forever preferred_lft forever
43: flannel0: <POINTOPOINT,MULTICAST,NOARP,UP,LOWER_UP> mtu 1472 qdisc pfifo_fast state UNKNOWN qlen 500
    link/none
    inet 192.168.55.0/16 scope global flannel0
44: docker0: <BROADCAST,MULTICAST,UP,LOWER_UP> mtu 1472 qdisc noqueue state UP
    link/ether 56:84:7a:fe:97:99 brd ff:ff:ff:ff:ff:ff
    inet 192.168.55.1/24 scope global docker0
    inet6 fe80::5484:7aff:fefe:9799/64 scope link
       valid_lft forever preferred_lft forever
48: veth1af52cc: <BROADCAST,UP,LOWER_UP> mtu 1472 qdisc noqueue master docker0 state UP
    link/ether 96:99:a8:54:c5:d1 brd ff:ff:ff:ff:ff:ff
    inet6 fe80::9499:a8ff:fe54:c5d1/64 scope link
       valid_lft forever preferred_lft forever
-bash-4.2$ sudo /sbin/iptables -L -n
Chain INPUT (policy ACCEPT)
target     prot opt source               destination

Chain FORWARD (policy ACCEPT)
target     prot opt source               destination

Chain OUTPUT (policy ACCEPT)
target     prot opt source               destination
-bash-4.2$ sudo /sbin/tcpdump -i eth0 arp
tcpdump: verbose output suppressed, use -v or -vv for full protocol decode
listening on eth0, link-type EN10MB (Ethernet), capture size 65535 bytes
12:39:17.511609 ARP, Request who-has slc09fqh.us.oracle.com tell slc09fqg.us.oracle.com, length 46
12:39:17.831438 ARP, Request who-has ucf-c1z1-rtr-1-v121-hsrp.ucf.oracle.com tell slc03qmy.us.oracle.com, length 46
12:39:18.018123 ARP, Reply slc05gdy.us.oracle.com is-at 02:16:3e:52:b3:2f (oui Unknown), length 46
12:39:18.249454 ARP, Request who-has slc09fqm.us.oracle.com tell slc09fqi.us.oracle.com, length 46
12:39:18.437566 ARP, Request who-has slc03qnm.us.oracle.com tell slc03qwg.us.oracle.com, length 46
12:39:18.514568 ARP, Request who-has slc09fqh.us.oracle.com tell slc09fqg.us.oracle.com, length 46
12:39:18.668144 ARP, Request who-has ucf-c1z1-rtr-1-v121-hsrp.ucf.oracle.com tell slc05krg.us.oracle.com, length 46
12:39:18.813865 ARP, Request who-has slc09fkf.us.oracle.com (Broadcast) tell ucf-c1z1-rtr-2-v121.ucf.oracle.com, length 46
12:39:19.098823 ARP, Request who-has slc07jey.us.oracle.com tell slc07jdo.us.oracle.com, length 46
12:39:19.098834 ARP, Reply slc07jey.us.oracle.com is-at 00:21:f6:2c:0d:c8 (oui Unknown), length 28
12:39:19.517608 ARP, Request who-has slc09fqh.us.oracle.com tell slc09fqg.us.oracle.com, length 46
12:39:19.812425 ARP, Request who-has slc09fqm.us.oracle.com tell slc09fqi.us.oracle.com, length 46
12:39:20.016368 ARP, Reply slc05gdx.us.oracle.com is-at 02:16:3e:52:b3:2e (oui Unknown), length 46
12:39:20.519606 ARP, Request who-has slc09fqh.us.oracle.com tell slc09fqg.us.oracle.com, length 46
12:39:20.815397 ARP, Request who-has slc09fqm.us.oracle.com tell slc09fqi.us.oracle.com, length 46
12:39:20.888729 ARP, Request who-has ucf-c1z1-rtr-1-v121-hsrp.ucf.oracle.com tell slc05kqp.us.oracle.com, length 46
12:39:20.979774 ARP, Request who-has slc05gdv.us.oracle.com (Broadcast) tell slc05gdv.us.oracle.com, length 46
12:39:21.256104 ARP, Request who-has slc05gdy.us.oracle.com (Broadcast) tell slc05gdy.us.oracle.com, length 46
12:39:21.440497 ARP, Request who-has ucf-c1z1-rtr-1-v121-hsrp.ucf.oracle.com tell slc05kvo.us.oracle.com, length 46
12:39:21.521636 ARP, Request who-has slc09fqh.us.oracle.com tell slc09fqg.us.oracle.com, length 46
12:39:21.817435 ARP, Request who-has slc09fqm.us.oracle.com tell slc09fqi.us.oracle.com, length 46
12:39:22.523586 ARP, Request who-has slc09fqh.us.oracle.com tell slc09fqg.us.oracle.com, length 46
12:39:22.825122 ARP, Request who-has slc09fkf.us.oracle.com (Broadcast) tell ucf-c1z1-rtr-2-v121.ucf.oracle.com, length 46
12:39:22.855255 ARP, Request who-has slc03qtz.us.oracle.com tell slc03psg.us.oracle.com, length 46
12:39:23.106625 ARP, Request who-has slc09fqm.us.oracle.com tell slc09fqi.us.oracle.com, length 46
12:39:23.525614 ARP, Request who-has slc09fqh.us.oracle.com tell slc09fqg.us.oracle.com, length 46
12:39:23.688743 ARP, Request who-has slc09fjc.us.oracle.com tell slc09fjf.us.oracle.com, length 46
12:39:23.689262 ARP, Request who-has slc09fjf.us.oracle.com tell slc09fjc.us.oracle.com, length 46
12:39:23.776303 ARP, Request who-has slc09fjb.us.oracle.com tell slc09fix.us.oracle.com, length 46
12:39:24.107465 ARP, Request who-has slc09fqm.us.oracle.com tell slc09fqi.us.oracle.com, length 46
12:39:24.614436 ARP, Request who-has slc07jfm.us.oracle.com (Broadcast) tell slc07jfm.us.oracle.com, length 46
12:39:25.109527 ARP, Request who-has slc09fqm.us.oracle.com tell slc09fqi.us.oracle.com, length 46
12:39:26.215549 ARP, Request who-has slc09fqm.us.oracle.com tell slc09fqi.us.oracle.com, length 46
12:39:27.217570 ARP, Request who-has slc09fqm.us.oracle.com tell slc09fqi.us.oracle.com, length 46
12:39:27.538667 ARP, Request who-has slc09fqh.us.oracle.com tell slc09fqg.us.oracle.com, length 46
12:39:27.759531 ARP, Request who-has slc03pzb.us.oracle.com (Broadcast) tell slc03pzb.us.oracle.com, length 46
12:39:27.979521 ARP, Request who-has ucf-c1z1-rtr-1-v121-hsrp.ucf.oracle.com tell slc09fjb.us.oracle.com, length 46
12:39:28.114673 ARP, Request who-has slc09fqo.us.oracle.com tell slc09fqg.us.oracle.com, length 46
12:39:28.219529 ARP, Request who-has slc09fqm.us.oracle.com tell slc09fqi.us.oracle.com, length 46
12:39:28.506451 ARP, Request who-has slc09flz.us.oracle.com tell slc03qwv.us.oracle.com, length 46
12:39:28.541656 ARP, Request who-has slc09fqh.us.oracle.com tell slc09fqg.us.oracle.com, length 46
12:39:29.117748 ARP, Request who-has slc09fqo.us.oracle.com tell slc09fqg.us.oracle.com, length 46
12:39:29.150238 ARP, Request who-has slc07jix.us.oracle.com (Broadcast) tell slc07jix.us.oracle.com, length 46
12:39:29.257504 ARP, Request who-has slc09fqm.us.oracle.com tell slc09fqi.us.oracle.com, length 46
12:39:29.543724 ARP, Request who-has slc09fqh.us.oracle.com tell slc09fqg.us.oracle.com, length 46
12:39:29.819022 ARP, Request who-has ucf-c1z1-rtr-1-v121-hsrp.ucf.oracle.com tell slc09fje.us.oracle.com, length 46
12:39:30.119743 ARP, Request who-has slc09fqo.us.oracle.com tell slc09fqg.us.oracle.com, length 46
12:39:30.259559 ARP, Request who-has slc09fqm.us.oracle.com tell slc09fqi.us.oracle.com, length 46
12:39:30.546726 ARP, Request who-has slc09fqh.us.oracle.com tell slc09fqg.us.oracle.com, length 46
12:39:30.827183 ARP, Request who-has slc09fkf.us.oracle.com (Broadcast) tell ucf-c1z1-rtr-2-v121.ucf.oracle.com, length 46
12:39:31.122735 ARP, Request who-has slc09fqo.us.oracle.com tell slc09fqg.us.oracle.com, length 46
12:39:31.261568 ARP, Request who-has slc09fqm.us.oracle.com tell slc09fqi.us.oracle.com, length 46

52 packets captured
61 packets received by filter
0 packets dropped by kernel
-bash-4.2$

Thanks,
Robert

**Comment by rpatrick00** [comment]
Ugh, the output of ip addr show was mangled above...here it is again replacing greater than and less than signs with curly braces

-bash-4.2$ /sbin/ip addr show
1: lo: {LOOPBACK,UP,LOWER_UP}--- mtu 65536 qdisc noqueue state UNKNOWN
    link/loopback 00:00:00:00:00:00 brd 00:00:00:00:00:00
    inet 127.0.0.1/8 scope host lo
    inet6 ::1/128 scope host
       valid_lft forever preferred_lft forever
2: eth0: -{BROADCAST,MULTICAST,UP,LOWER_UP} mtu 1500 qdisc pfifo_fast state UP qlen 1000
    link/ether 00:21:f6:2c:0d:c8 brd ff:ff:ff:ff:ff:ff
    inet 10.240.182.228/21 brd 10.240.183.255 scope global eth0
    inet6 2606:b400:2010:4055:221:f6ff:fe2c:dc8/64 scope global dynamic
       valid_lft 2591844sec preferred_lft 604644sec
    inet6 fe80::221:f6ff:fe2c:dc8/64 scope link
       valid_lft forever preferred_lft forever
43: flannel0: {POINTOPOINT,MULTICAST,NOARP,UP,LOWER_UP} mtu 1472 qdisc pfifo_fast state UNKNOWN qlen 500
    link/none
    inet 192.168.55.0/16 scope global flannel0
44: docker0: {BROADCAST,MULTICAST,UP,LOWER_UP} mtu 1472 qdisc noqueue state UP
    link/ether 56:84:7a:fe:97:99 brd ff:ff:ff:ff:ff:ff
    inet 192.168.55.1/24 scope global docker0
    inet6 fe80::5484:7aff:fefe:9799/64 scope link
       valid_lft forever preferred_lft forever
48: veth1af52cc: {BROADCAST,UP,LOWER_UP} mtu 1472 qdisc noqueue master docker0 state UP
    link/ether 96:99:a8:54:c5:d1 brd ff:ff:ff:ff:ff:ff
    inet6 fe80::9499:a8ff:fe54:c5d1/64 scope link
       valid_lft forever preferred_lft forever

**Comment by eyakubovich** [comment]
@rpatrick00 One other thing to check are values of `/coreos.com/network/subnets/`. You'll see one key per subnet. Do an `etcdctl get` on those keys and make sure the `PublicIP` is what you expect (like 10.240.182.228). Also check flannel logs on host2 to make sure you see SubnetAdded line for source's subnet.

Hang in there, we'll figure out what went wrong.

**Comment by rpatrick00** [comment]
Yeah, I had already looked at these...everything looks correct.

On host1 (working):
-bash-4.2$ hostname
slc06ptm.us.oracle.com
-bash-4.2$ ping slc06ptm.us.oracle.com
PING slc06ptm.us.oracle.com (10.240.212.144) 56(84) bytes of data.
64 bytes from slc06ptm.us.oracle.com (10.240.212.144): icmp_seq=1 ttl=64 time=0.028 ms
64 bytes from slc06ptm.us.oracle.com (10.240.212.144): icmp_seq=2 ttl=64 time=0.024 ms

--- slc06ptm.us.oracle.com ping statistics ---
2 packets transmitted, 2 received, 0% packet loss, time 999ms
rtt min/avg/max/mdev = 0.024/0.026/0.028/0.002 ms
-bash-4.2$ etcdctl ls /coreos.com/network/subnets/
/coreos.com/network/subnets/192.168.55.0-24
/coreos.com/network/subnets/192.168.83.0-24
-bash-4.2$ etcdctl get /coreos.com/network/subnets/192.168.83.0-24
{"PublicIP":"10.240.212.144"}
-bash-4.2$ etcdctl get /coreos.com/network/subnets/192.168.55.0-24
{"PublicIP":"10.240.182.228"}
-bash-4.2$


On host2(not working):
-bash-4.2$ hostname
slc07jey.us.oracle.com
-bash-4.2$ ping slc07jey.us.oracle.com
PING slc07jey.us.oracle.com (10.240.182.228) 56(84) bytes of data.
64 bytes from slc07jey.us.oracle.com (10.240.182.228): icmp_seq=1 ttl=64 time=0.047 ms
64 bytes from slc07jey.us.oracle.com (10.240.182.228): icmp_seq=2 ttl=64 time=0.034 ms

--- slc07jey.us.oracle.com ping statistics ---
2 packets transmitted, 2 received, 0% packet loss, time 999ms
rtt min/avg/max/mdev = 0.034/0.040/0.047/0.009 ms
-bash-4.2$ etcdctl ls /coreos.com/network/subnets/
/coreos.com/network/subnets/192.168.55.0-24
/coreos.com/network/subnets/192.168.83.0-24
-bash-4.2$ etcdctl get /coreos.com/network/subnets/192.168.55.0-24
{"PublicIP":"10.240.182.228"}
-bash-4.2$ etcdctl get /coreos.com/network/subnets/192.168.83.0-24
{"PublicIP":"10.240.212.144"}
-bash-4.2$

**Comment by rpatrick00** [comment]
Yesterday, on the machine that is failing, flannel was adding both subnets.  Today, it is not...looks like it is failing on a put to etcd:

Jul 17 17:50:57 slc07jey flanneld: I0717 17:50:57.534711 01331 main.go:275] Installing signal handlers
Jul 17 17:50:57 slc07jey flanneld: I0717 17:50:57.535177 01331 main.go:189] Using 10.240.182.228 as external interface
Jul 17 17:50:57 slc07jey flanneld: go-etcd2015/07/17 17:50:57 DEBUG: get /coreos.com/network/config [http://127.0.0.1:4001]
Jul 17 17:50:57 slc07jey flanneld: go-etcd2015/07/17 17:50:57 DEBUG: Connecting to etcd: attempt 1 for keys/coreos.com/network/config?quorum=false&recursive=false&sorted=false
Jul 17 17:50:57 slc07jey flanneld: go-etcd2015/07/17 17:50:57 DEBUG: send.request.to http://127.0.0.1:4001/v2/keys/coreos.com/network/config?quorum=false&recursive=false&sorted=false | method GET
Jul 17 17:50:57 slc07jey flanneld: go-etcd2015/07/17 17:50:57 DEBUG: network error: Get http://127.0.0.1:4001/v2/keys/coreos.com/network/config?quorum=false&recursive=false&sorted=false: dial tcp 127.0.0.1:4001: connection refused
Jul 17 17:50:57 slc07jey flanneld: go-etcd2015/07/17 17:50:57 DEBUG: Connecting to etcd: attempt 2 for keys/coreos.com/network/config?quorum=false&recursive=false&sorted=false
Jul 17 17:50:57 slc07jey flanneld: go-etcd2015/07/17 17:50:57 DEBUG: send.request.to http://127.0.0.1:2379/v2/keys/coreos.com/network/config?quorum=false&recursive=false&sorted=false | method GET
Jul 17 17:50:57 slc07jey flanneld: go-etcd2015/07/17 17:50:57 DEBUG: network error: Get http://127.0.0.1:2379/v2/keys/coreos.com/network/config?quorum=false&recursive=false&sorted=false: dial tcp 127.0.0.1:2379: connection refused
Jul 17 17:50:57 slc07jey flanneld: go-etcd2015/07/17 17:50:57 DEBUG: Connecting to etcd: attempt 3 for keys/coreos.com/network/config?quorum=false&recursive=false&sorted=false
Jul 17 17:50:57 slc07jey flanneld: go-etcd2015/07/17 17:50:57 DEBUG: send.request.to http://127.0.0.1:2379/v2/keys/coreos.com/network/config?quorum=false&recursive=false&sorted=false | method GET
Jul 17 17:50:57 slc07jey flanneld: go-etcd2015/07/17 17:50:57 DEBUG: network error: Get http://127.0.0.1:2379/v2/keys/coreos.com/network/config?quorum=false&recursive=false&sorted=false: dial tcp 127.0.0.1:2379: connection refused
Jul 17 17:50:57 slc07jey flanneld: go-etcd2015/07/17 17:50:57 DEBUG: Connecting to etcd: attempt 4 for keys/coreos.com/network/config?quorum=false&recursive=false&sorted=false
Jul 17 17:50:57 slc07jey flanneld: go-etcd2015/07/17 17:50:57 DEBUG: send.request.to http://127.0.0.1:4001/v2/keys/coreos.com/network/config?quorum=false&recursive=false&sorted=false | method GET
Jul 17 17:50:57 slc07jey flanneld: go-etcd2015/07/17 17:50:57 DEBUG: network error: Get http://127.0.0.1:4001/v2/keys/coreos.com/network/config?quorum=false&recursive=false&sorted=false: dial tcp 127.0.0.1:4001: connection refused
Jul 17 17:50:57 slc07jey flanneld: go-etcd2015/07/17 17:50:57 DEBUG: Connecting to etcd: attempt 5 for keys/coreos.com/network/config?quorum=false&recursive=false&sorted=false
Jul 17 17:50:57 slc07jey flanneld: go-etcd2015/07/17 17:50:57 DEBUG: send.request.to http://127.0.0.1:2379/v2/keys/coreos.com/network/config?quorum=false&recursive=false&sorted=false | method GET
Jul 17 17:50:58 slc07jey flanneld: go-etcd2015/07/17 17:50:58 DEBUG: recv.response.from
Jul 17 17:50:58 slc07jey flanneld: go-etcd2015/07/17 17:50:58 DEBUG: recv.success
Jul 17 17:50:58 slc07jey flanneld: go-etcd2015/07/17 17:50:58 DEBUG: get /coreos.com/network/config [http://127.0.0.1:2379]
Jul 17 17:50:58 slc07jey flanneld: go-etcd2015/07/17 17:50:58 DEBUG: Connecting to etcd: attempt 1 for keys/coreos.com/network/config?quorum=false&recursive=false&sorted=false
Jul 17 17:50:58 slc07jey flanneld: go-etcd2015/07/17 17:50:58 DEBUG: send.request.to http://127.0.0.1:2379/v2/keys/coreos.com/network/config?quorum=false&recursive=false&sorted=false | method GET
Jul 17 17:50:58 slc07jey flanneld: go-etcd2015/07/17 17:50:58 DEBUG: recv.response.from
Jul 17 17:50:58 slc07jey flanneld: go-etcd2015/07/17 17:50:58 DEBUG: recv.success
Jul 17 17:50:58 slc07jey flanneld: go-etcd2015/07/17 17:50:58 DEBUG: get /coreos.com/network/subnets [http://127.0.0.1:2379]
Jul 17 17:50:58 slc07jey flanneld: go-etcd2015/07/17 17:50:58 DEBUG: Connecting to etcd: attempt 1 for keys/coreos.com/network/subnets?quorum=false&recursive=true&sorted=false
Jul 17 17:50:58 slc07jey flanneld: go-etcd2015/07/17 17:50:58 DEBUG: send.request.to http://127.0.0.1:2379/v2/keys/coreos.com/network/subnets?quorum=false&recursive=true&sorted=false | method GET
Jul 17 17:50:58 slc07jey flanneld: go-etcd2015/07/17 17:50:58 DEBUG: recv.response.from
Jul 17 17:50:58 slc07jey flanneld: go-etcd2015/07/17 17:50:58 DEBUG: recv.success
Jul 17 17:50:58 slc07jey flanneld: go-etcd2015/07/17 17:50:58 DEBUG: put /coreos.com/network/subnets/192.168.55.0-24, {"PublicIP":"10.240.182.228"}, ttl: 86400, [http://127.0.0.1:2379]
Jul 17 17:50:58 slc07jey flanneld: go-etcd2015/07/17 17:50:58 DEBUG: Connecting to etcd: attempt 1 for keys/coreos.com/network/subnets/192.168.55.0-24
Jul 17 17:50:58 slc07jey flanneld: go-etcd2015/07/17 17:50:58 DEBUG: send.request.to http://127.0.0.1:2379/v2/keys/coreos.com/network/subnets/192.168.55.0-24 | method PUT
Jul 17 17:51:04 slc07jey flanneld: go-etcd2015/07/17 17:51:04 DEBUG: recv.response.from
Jul 17 17:51:04 slc07jey flanneld: go-etcd2015/07/17 17:51:04 WARNING: bad response status code500
Jul 17 17:51:04 slc07jey flanneld: go-etcd2015/07/17 17:51:04 DEBUG: Connecting to etcd: attempt 2 for keys/coreos.com/network/subnets/192.168.55.0-24
Jul 17 17:51:04 slc07jey flanneld: go-etcd2015/07/17 17:51:04 DEBUG: send.request.to http://127.0.0.1:2379/v2/keys/coreos.com/network/subnets/192.168.55.0-24 | method PUT
Jul 17 17:51:10 slc07jey flanneld: go-etcd2015/07/17 17:51:10 DEBUG: recv.response.from
Jul 17 17:51:10 slc07jey flanneld: go-etcd2015/07/17 17:51:10 WARNING: bad response status code500
Jul 17 17:51:10 slc07jey flanneld: go-etcd2015/07/17 17:51:10 DEBUG: Connecting to etcd: attempt 3 for keys/coreos.com/network/subnets/192.168.55.0-24
Jul 17 17:51:10 slc07jey flanneld: go-etcd2015/07/17 17:51:10 DEBUG: send.request.to http://127.0.0.1:2379/v2/keys/coreos.com/network/subnets/192.168.55.0-24 | method PUT
Jul 17 17:51:16 slc07jey flanneld: go-etcd2015/07/17 17:51:16 DEBUG: recv.response.from
Jul 17 17:51:16 slc07jey flanneld: go-etcd2015/07/17 17:51:16 WARNING: bad response status code500
Jul 17 17:51:16 slc07jey flanneld: go-etcd2015/07/17 17:51:16 DEBUG: Connecting to etcd: attempt 4 for keys/coreos.com/network/subnets/192.168.55.0-24
Jul 17 17:51:16 slc07jey flanneld: go-etcd2015/07/17 17:51:16 DEBUG: send.request.to http://127.0.0.1:2379/v2/keys/coreos.com/network/subnets/192.168.55.0-24 | method PUT
Jul 17 17:51:22 slc07jey flanneld: go-etcd2015/07/17 17:51:22 DEBUG: recv.response.from
Jul 17 17:51:22 slc07jey flanneld: E0717 17:51:22.829497 01331 etcd.go:90] Failed to acquire subnet: 501: All the given peers are not reachable (failed to propose on members [http://127.0.0.1:4001 http://127.0.0.1:2379] twice [last error: Unexpected HTTP status code]) [0]
Jul 17 17:51:23 slc07jey flanneld: go-etcd2015/07/17 17:51:23 DEBUG: get /coreos.com/network/subnets [http://127.0.0.1:2379]
Jul 17 17:51:23 slc07jey flanneld: go-etcd2015/07/17 17:51:23 DEBUG: Connecting to etcd: attempt 1 for keys/coreos.com/network/subnets?quorum=false&recursive=true&sorted=false
Jul 17 17:51:23 slc07jey flanneld: go-etcd2015/07/17 17:51:23 DEBUG: send.request.to http://127.0.0.1:2379/v2/keys/coreos.com/network/subnets?quorum=false&recursive=true&sorted=false | method GET
Jul 17 17:51:23 slc07jey flanneld: go-etcd2015/07/17 17:51:23 DEBUG: recv.response.from
Jul 17 17:51:23 slc07jey flanneld: go-etcd2015/07/17 17:51:23 DEBUG: recv.success
Jul 17 17:51:23 slc07jey flanneld: go-etcd2015/07/17 17:51:23 DEBUG: put /coreos.com/network/subnets/192.168.55.0-24, {"PublicIP":"10.240.182.228"}, ttl: 86400, [http://127.0.0.1:2379]
Jul 17 17:51:23 slc07jey flanneld: go-etcd2015/07/17 17:51:23 DEBUG: Connecting to etcd: attempt 1 for keys/coreos.com/network/subnets/192.168.55.0-24
Jul 17 17:51:23 slc07jey flanneld: go-etcd2015/07/17 17:51:23 DEBUG: send.request.to http://127.0.0.1:2379/v2/keys/coreos.com/network/subnets/192.168.55.0-24 | method PUT
Jul 17 17:51:29 slc07jey flanneld: go-etcd2015/07/17 17:51:29 DEBUG: recv.response.from
Jul 17 17:51:30 slc07jey flanneld: go-etcd2015/07/17 17:51:30 WARNING: bad response status code500
Jul 17 17:51:30 slc07jey flanneld: go-etcd2015/07/17 17:51:30 DEBUG: Connecting to etcd: attempt 2 for keys/coreos.com/network/subnets/192.168.55.0-24
Jul 17 17:51:30 slc07jey flanneld: go-etcd2015/07/17 17:51:30 DEBUG: send.request.to http://127.0.0.1:2379/v2/keys/coreos.com/network/subnets/192.168.55.0-24 | method PUT
Jul 17 17:51:36 slc07jey flanneld: go-etcd2015/07/17 17:51:36 DEBUG: recv.response.from
Jul 17 17:51:36 slc07jey flanneld: go-etcd2015/07/17 17:51:36 WARNING: bad response status code500
Jul 17 17:51:36 slc07jey flanneld: go-etcd2015/07/17 17:51:36 DEBUG: Connecting to etcd: attempt 3 for keys/coreos.com/network/subnets/192.168.55.0-24
Jul 17 17:51:36 slc07jey flanneld: go-etcd2015/07/17 17:51:36 DEBUG: send.request.to http://127.0.0.1:2379/v2/keys/coreos.com/network/subnets/192.168.55.0-24 | method PUT
Jul 17 17:51:42 slc07jey flanneld: go-etcd2015/07/17 17:51:42 DEBUG: recv.response.from
Jul 17 17:51:42 slc07jey flanneld: go-etcd2015/07/17 17:51:42 WARNING: bad response status code500
Jul 17 17:51:42 slc07jey flanneld: go-etcd2015/07/17 17:51:42 DEBUG: Connecting to etcd: attempt 4 for keys/coreos.com/network/subnets/192.168.55.0-24
Jul 17 17:51:42 slc07jey flanneld: go-etcd2015/07/17 17:51:42 DEBUG: send.request.to http://127.0.0.1:2379/v2/keys/coreos.com/network/subnets/192.168.55.0-24 | method PUT
Jul 17 17:51:48 slc07jey flanneld: go-etcd2015/07/17 17:51:48 DEBUG: recv.response.from
Jul 17 17:51:48 slc07jey flanneld: E0717 17:51:48.610513 01331 etcd.go:90] Failed to acquire subnet: 501: All the given peers are not reachable (failed to propose on members [http://127.0.0.1:4001 http://127.0.0.1:2379] twice [last error: Unexpected HTTP status code]) [0]
Jul 17 17:51:49 slc07jey flanneld: go-etcd2015/07/17 17:51:49 DEBUG: get /coreos.com/network/subnets [http://127.0.0.1:2379]
Jul 17 17:51:49 slc07jey flanneld: go-etcd2015/07/17 17:51:49 DEBUG: Connecting to etcd: attempt 1 for keys/coreos.com/network/subnets?quorum=false&recursive=true&sorted=false
Jul 17 17:51:49 slc07jey flanneld: go-etcd2015/07/17 17:51:49 DEBUG: send.request.to http://127.0.0.1:2379/v2/keys/coreos.com/network/subnets?quorum=false&recursive=true&sorted=false | method GET
Jul 17 17:51:49 slc07jey flanneld: go-etcd2015/07/17 17:51:49 DEBUG: recv.response.from
Jul 17 17:51:49 slc07jey flanneld: go-etcd2015/07/17 17:51:49 DEBUG: recv.success
Jul 17 17:51:49 slc07jey flanneld: go-etcd2015/07/17 17:51:49 DEBUG: put /coreos.com/network/subnets/192.168.55.0-24, {"PublicIP":"10.240.182.228"}, ttl: 86400, [http://127.0.0.1:2379]
Jul 17 17:51:49 slc07jey flanneld: go-etcd2015/07/17 17:51:49 DEBUG: Connecting to etcd: attempt 1 for keys/coreos.com/network/subnets/192.168.55.0-24
Jul 17 17:51:49 slc07jey flanneld: go-etcd2015/07/17 17:51:49 DEBUG: send.request.to http://127.0.0.1:2379/v2/keys/coreos.com/network/subnets/192.168.55.0-24 | method PUT
Jul 17 17:51:55 slc07jey flanneld: go-etcd2015/07/17 17:51:55 DEBUG: recv.response.from
Jul 17 17:51:55 slc07jey flanneld: go-etcd2015/07/17 17:51:55 WARNING: bad response status code500
Jul 17 17:51:55 slc07jey flanneld: go-etcd2015/07/17 17:51:55 DEBUG: Connecting to etcd: attempt 2 for keys/coreos.com/network/subnets/192.168.55.0-24
Jul 17 17:51:55 slc07jey flanneld: go-etcd2015/07/17 17:51:55 DEBUG: send.request.to http://127.0.0.1:2379/v2/keys/coreos.com/network/subnets/192.168.55.0-24 | method PUT
Jul 17 17:52:01 slc07jey flanneld: go-etcd2015/07/17 17:52:01 DEBUG: recv.response.from
Jul 17 17:52:02 slc07jey flanneld: go-etcd2015/07/17 17:52:02 WARNING: bad response status code500
Jul 17 17:52:02 slc07jey flanneld: go-etcd2015/07/17 17:52:02 DEBUG: Connecting to etcd: attempt 3 for keys/coreos.com/network/subnets/192.168.55.0-24
Jul 17 17:52:02 slc07jey flanneld: go-etcd2015/07/17 17:52:02 DEBUG: send.request.to http://127.0.0.1:2379/v2/keys/coreos.com/network/subnets/192.168.55.0-24 | method PUT
Jul 17 17:52:08 slc07jey flanneld: go-etcd2015/07/17 17:52:08 DEBUG: recv.response.from
Jul 17 17:52:08 slc07jey flanneld: go-etcd2015/07/17 17:52:08 WARNING: bad response status code500
Jul 17 17:52:08 slc07jey flanneld: go-etcd2015/07/17 17:52:08 DEBUG: Connecting to etcd: attempt 4 for keys/coreos.com/network/subnets/192.168.55.0-24
Jul 17 17:52:08 slc07jey flanneld: go-etcd2015/07/17 17:52:08 DEBUG: send.request.to http://127.0.0.1:2379/v2/keys/coreos.com/network/subnets/192.168.55.0-24 | method PUT
Jul 17 17:52:14 slc07jey flanneld: go-etcd2015/07/17 17:52:14 DEBUG: recv.response.from
Jul 17 17:52:14 slc07jey flanneld: E0717 17:52:14.391613 01331 etcd.go:90] Failed to acquire subnet: 501: All the given peers are not reachable (failed to propose on members [http://127.0.0.1:4001 http://127.0.0.1:2379] twice [last error: Unexpected HTTP status code]) [0]
Jul 17 17:52:15 slc07jey flanneld: go-etcd2015/07/17 17:52:15 DEBUG: get /coreos.com/network/subnets [http://127.0.0.1:2379]
Jul 17 17:52:15 slc07jey flanneld: go-etcd2015/07/17 17:52:15 DEBUG: Connecting to etcd: attempt 1 for keys/coreos.com/network/subnets?quorum=false&recursive=true&sorted=false
Jul 17 17:52:15 slc07jey flanneld: go-etcd2015/07/17 17:52:15 DEBUG: send.request.to http://127.0.0.1:2379/v2/keys/coreos.com/network/subnets?quorum=false&recursive=true&sorted=false | method GET
Jul 17 17:52:15 slc07jey flanneld: go-etcd2015/07/17 17:52:15 DEBUG: recv.response.from
Jul 17 17:52:15 slc07jey flanneld: go-etcd2015/07/17 17:52:15 DEBUG: recv.success
Jul 17 17:52:15 slc07jey flanneld: go-etcd2015/07/17 17:52:15 DEBUG: put /coreos.com/network/subnets/192.168.55.0-24, {"PublicIP":"10.240.182.228"}, ttl: 86400, [http://127.0.0.1:2379]
Jul 17 17:52:15 slc07jey flanneld: go-etcd2015/07/17 17:52:15 DEBUG: Connecting to etcd: attempt 1 for keys/coreos.com/network/subnets/192.168.55.0-24
Jul 17 17:52:15 slc07jey flanneld: go-etcd2015/07/17 17:52:15 DEBUG: send.request.to http://127.0.0.1:2379/v2/keys/coreos.com/network/subnets/192.168.55.0-24 | method PUT
Jul 17 17:52:21 slc07jey flanneld: go-etcd2015/07/17 17:52:21 DEBUG: recv.response.from
Jul 17 17:52:21 slc07jey flanneld: go-etcd2015/07/17 17:52:21 WARNING: bad response status code500
Jul 17 17:52:21 slc07jey flanneld: go-etcd2015/07/17 17:52:21 DEBUG: Connecting to etcd: attempt 2 for keys/coreos.com/network/subnets/192.168.55.0-24
Jul 17 17:52:21 slc07jey flanneld: go-etcd2015/07/17 17:52:21 DEBUG: send.request.to http://127.0.0.1:2379/v2/keys/coreos.com/network/subnets/192.168.55.0-24 | method PUT
Jul 17 17:52:27 slc07jey flanneld: go-etcd2015/07/17 17:52:27 DEBUG: recv.response.from
Jul 17 17:52:27 slc07jey flanneld: go-etcd2015/07/17 17:52:27 WARNING: bad response status code500
Jul 17 17:52:27 slc07jey flanneld: go-etcd2015/07/17 17:52:27 DEBUG: Connecting to etcd: attempt 3 for keys/coreos.com/network/subnets/192.168.55.0-24
Jul 17 17:52:27 slc07jey flanneld: go-etcd2015/07/17 17:52:27 DEBUG: send.request.to http://127.0.0.1:2379/v2/keys/coreos.com/network/subnets/192.168.55.0-24 | method PUT
Jul 17 17:52:33 slc07jey flanneld: go-etcd2015/07/17 17:52:33 DEBUG: recv.response.from
Jul 17 17:52:34 slc07jey flanneld: go-etcd2015/07/17 17:52:34 WARNING: bad response status code500
Jul 17 17:52:34 slc07jey flanneld: go-etcd2015/07/17 17:52:34 DEBUG: Connecting to etcd: attempt 4 for keys/coreos.com/network/subnets/192.168.55.0-24
Jul 17 17:52:34 slc07jey flanneld: go-etcd2015/07/17 17:52:34 DEBUG: send.request.to http://127.0.0.1:2379/v2/keys/coreos.com/network/subnets/192.168.55.0-24 | method PUT
Jul 17 17:52:40 slc07jey flanneld: go-etcd2015/07/17 17:52:40 DEBUG: recv.response.from
Jul 17 17:52:40 slc07jey flanneld: E0717 17:52:40.172270 01331 etcd.go:90] Failed to acquire subnet: 501: All the given peers are not reachable (failed to propose on members [http://127.0.0.1:4001 http://127.0.0.1:2379] twice [last error: Unexpected HTTP status code]) [0]
Jul 17 17:52:41 slc07jey flanneld: go-etcd2015/07/17 17:52:41 DEBUG: get /coreos.com/network/subnets [http://127.0.0.1:2379]
Jul 17 17:52:41 slc07jey flanneld: go-etcd2015/07/17 17:52:41 DEBUG: Connecting to etcd: attempt 1 for keys/coreos.com/network/subnets?quorum=false&recursive=true&sorted=false
Jul 17 17:52:41 slc07jey flanneld: go-etcd2015/07/17 17:52:41 DEBUG: send.request.to http://127.0.0.1:2379/v2/keys/coreos.com/network/subnets?quorum=false&recursive=true&sorted=false | method GET
Jul 17 17:52:41 slc07jey flanneld: go-etcd2015/07/17 17:52:41 DEBUG: recv.response.from
Jul 17 17:52:41 slc07jey flanneld: go-etcd2015/07/17 17:52:41 DEBUG: recv.success
Jul 17 17:52:41 slc07jey flanneld: go-etcd2015/07/17 17:52:41 DEBUG: put /coreos.com/network/subnets/192.168.55.0-24, {"PublicIP":"10.240.182.228"}, ttl: 86400, [http://127.0.0.1:2379]
Jul 17 17:52:41 slc07jey flanneld: go-etcd2015/07/17 17:52:41 DEBUG: Connecting to etcd: attempt 1 for keys/coreos.com/network/subnets/192.168.55.0-24
Jul 17 17:52:41 slc07jey flanneld: go-etcd2015/07/17 17:52:41 DEBUG: send.request.to http://127.0.0.1:2379/v2/keys/coreos.com/network/subnets/192.168.55.0-24 | method PUT
Jul 17 17:52:41 slc07jey flanneld: go-etcd2015/07/17 17:52:41 DEBUG: recv.response.from
Jul 17 17:52:41 slc07jey flanneld: go-etcd2015/07/17 17:52:41 DEBUG: recv.success
Jul 17 17:52:41 slc07jey flanneld: I0717 17:52:41.255426 01331 etcd.go:83] Subnet lease acquired: 192.168.55.0/24
Jul 17 17:52:41 slc07jey flanneld: I0717 17:52:41.275771 01331 ipmasq.go:47] Adding iptables rule: FLANNEL -d 192.168.0.0/16 -j ACCEPT
Jul 17 17:52:41 slc07jey flanneld: I0717 17:52:41.278856 01331 ipmasq.go:47] Adding iptables rule: FLANNEL ! -d 224.0.0.0/4 -j MASQUERADE
Jul 17 17:52:41 slc07jey flanneld: I0717 17:52:41.303215 01331 ipmasq.go:47] Adding iptables rule: POSTROUTING -s 192.168.0.0/16 -j FLANNEL
Jul 17 17:52:41 slc07jey flanneld: I0717 17:52:41.315317 01331 udp.go:221] Watching for new subnet leases
Jul 17 17:52:41 slc07jey flanneld: go-etcd2015/07/17 17:52:41 DEBUG: rawWatch /coreos.com/network/subnets []
Jul 17 17:52:41 slc07jey flanneld: go-etcd2015/07/17 17:52:41 DEBUG: get /coreos.com/network/subnets [http://127.0.0.1:2379]
Jul 17 17:52:41 slc07jey flanneld: go-etcd2015/07/17 17:52:41 DEBUG: Connecting to etcd: attempt 1 for keys/coreos.com/network/subnets?recursive=true&wait=true
Jul 17 17:52:41 slc07jey flanneld: go-etcd2015/07/17 17:52:41 DEBUG: send.request.to http://127.0.0.1:2379/v2/keys/coreos.com/network/subnets?recursive=true&wait=true | method GET
Jul 17 17:52:41 slc07jey flanneld: go-etcd2015/07/17 17:52:41 DEBUG: recv.response.from

**Comment by rpatrick00** [comment]
I just updated flannel from Git, rebuilt, and restarted.  Now, everything is working fine.  Thanks again for your patience and help!

**Comment by eyakubovich** [comment]
@rpatrick00 Glad to hear it works (even if we don't know what went wrong).
