### ISSUE TITLE
openvpn->flannel routing

### ISSUE THREAD

**Issue by DorianGray** [coreos/flannel#142]
I have a 3 node coreos cluster running with flannel. On this cluster is a single service, the docker registry. I also have an ubuntu box set up running flannel, openvpn and a single docker container(jenkins) which is also in a flannel subnet. As a VPN client, I am able to talk to any of the coreos boxes directly. I am also able to talk to the jenkins service from the vpn. I am not, however, able to talk to the docker registry service from the vpn. I am able to talk to the docker registry service from the ubuntu box.

After further investigation, it seems like replies are never making it back to the ubuntu box after crossing flannel. I have confirmed the packets are arriving at the docker registry container, and replies are being sent.

I am running flannel with ipmasq=true and docker with ipmasq=false on the ubuntu box.

...what am I missing? Why do my replies get lost in the flannel?

**Comment by DorianGray** [comment]
Oh, openvpn is 10.8.0.0/16, main network is 10.0.0.0/16, flannel is 10.200.0.0/16.

**Comment by eyakubovich** [comment]
@DorianGray Is the CoreOS boxes also part of openvpn network? Is flannel running over main network or openvpn (did you explicitly specify the interface in cloud-config or --iface)? By default, flannel will run over the interface with the default route.

Can you run tcpdump on the flannel interface on the host with the docker registry and see if the replies make it there? If so, run tcpdump on the interface over which flannel is running on. BTW, you can run tcpdump in `toolbox` as it's not in CoreOS image. If you don't mind, can you also paste the output of `ip route` please.

**Comment by DorianGray** [comment]
Flannel is running on top of the main network. @packetcollision is working on this with me and has more information, he will respond in a bit to the other questions.

**Comment by packetcollision** [comment]
Sorry it took so long to respond.

Pinging from my mac, which is connected to the VPN on the gateway, I see ICMP packets coming in on the tun0 adapter and being forwarded to flannel0
```
ubuntu@gate:~$ sudo tcpdump -nni any icmp
tcpdump: verbose output suppressed, use -v or -vv for full protocol decode
listening on any, link-type LINUX_SLL (Linux cooked), capture size 65535 bytes
07:41:26.894521 IP 10.8.0.8 > 10.200.35.8: ICMP echo request, id 50715, seq 0, length 64
07:41:26.894545 IP 10.8.0.8 > 10.200.35.8: ICMP echo request, id 50715, seq 0, length 64
07:41:27.896322 IP 10.8.0.8 > 10.200.35.8: ICMP echo request, id 50715, seq 1, length 64
07:41:27.896349 IP 10.8.0.8 > 10.200.35.8: ICMP echo request, id 50715, seq 1, length 64
07:41:28.902880 IP 10.8.0.8 > 10.200.35.8: ICMP echo request, id 50715, seq 2, length 64
07:41:28.902894 IP 10.8.0.8 > 10.200.35.8: ICMP echo request, id 50715, seq 2, length 64
```
However on the coreos machine that is running the target container, I see no ICMP packets.

If I ping from one of the other coreos machines, I do see the ICMP packets in tcpdump, and I get responses:
```
-bash-4.3# tcpdump -nni any icmp
tcpdump: verbose output suppressed, use -v or -vv for full protocol decode
listening on any, link-type LINUX_SLL (Linux cooked), capture size 262144 bytes
07:46:53.071024 IP 10.200.1.0 > 10.200.35.8: ICMP echo request, id 31162, seq 1, length 64
07:46:53.071028 IP 10.200.1.0 > 10.200.35.8: ICMP echo request, id 31162, seq 1, length 64
07:46:53.071044 IP 10.200.35.8 > 10.200.1.0: ICMP echo reply, id 31162, seq 1, length 64
07:46:53.071044 IP 10.200.35.8 > 10.200.1.0: ICMP echo reply, id 31162, seq 1, length 64
07:46:53.071050 IP 10.200.35.8 > 10.200.1.0: ICMP echo reply, id 31162, seq 1, length 64
07:46:54.072329 IP 10.200.1.0 > 10.200.35.8: ICMP echo request, id 31162, seq 2, length 64
07:46:54.072343 IP 10.200.1.0 > 10.200.35.8: ICMP echo request, id 31162, seq 2, length 64
07:46:54.072347 IP 10.200.1.0 > 10.200.35.8: ICMP echo request, id 31162, seq 2, length 6
```

ip route of the target coreos machine is:
```
core@ip-10-0-12-219 ~ $ ip route
default via 10.0.12.1 dev eth0  proto dhcp  src 10.0.12.219  metric 1024
10.0.12.0/22 dev eth0  proto kernel  scope link  src 10.0.12.219
10.0.12.1 dev eth0  proto dhcp  scope link  src 10.0.12.219  metric 1024
10.200.0.0/16 dev flannel0  proto kernel  scope link  src 10.200.35.0
10.200.35.0/24 dev docker0  proto kernel  scope link  src 10.200.35.1
```

ip route of the gate machine is:
```
ubuntu@gate:~$ ip route
default via 10.0.4.1 dev eth0
10.0.4.0/26 dev eth0  proto kernel  scope link  src 10.0.4.34
10.8.0.0/24 dev tun0  proto kernel  scope link  src 10.8.0.1
10.200.0.0/16 dev flannel0  proto kernel  scope link  src 10.200.29.0
10.200.29.0/24 dev docker0  proto kernel  scope link  src 10.200.29.1
```

Please let me know if any other info would be helpful, or if there's anything we should try.

**Comment by eyakubovich** [comment]
@packetcollision @DorianGray I think I understand the setup now but unfortunately it's not going to work. All your machines need to be on the flannel network. Suppose a packet from your laptop (10.8.0.8) arrives at a CoreOS machine. To reply back, it would consult the routing table but since there's no 10.8.0.0/16 route, it'll take the default route (eth0) and the packet would leave unencapsulated and over the wrong interface. Even if you added a route 10.8.0.0/16 -> flannel0, flannel daemon would not know what to with it either (since it has it's own routing table that only knows about 10.200.0.0/16).

If you would like to use your gateway machine to bridge your laptop and docker registry on CoreOS machines, it's best to setup an HTTP proxy on that machine. It could then accept connections over 10.8.0.0/16 network and forward them to 10.200.0.0/16 network.

**Comment by DorianGray** [comment]
It seems like this could be solve by being able to set a static route in flannel...is that something that we can do? If we could set a route for 10.8.0.0/16 in flannel and point it at our openvpn server that would solve the issue, right?

**Comment by 0x4139** [comment]
we solved it using a static route in a docker container, you can see the project here https://registry.hub.docker.com/u/0x4139/openvpn/

**Comment by nqbao** [comment]
FYI: i managed to make it work over the VPN by adding a new IPTables route to route all traffic from VPN to the right gateway

```
iptables -t nat -I POSTROUTING -s 10.8.0.0/24 -d 10.233.64.0/18  -j SNAT --to-source 10.233.110.0
```

You may need to change the subnet of flannel and the flannel gateway ip

**Comment by 0x4139** [comment]
If you look at the script that starts in the container we have the same route :D

**Comment by Update200** [comment]
I'm really interested in this future and I really need to know more about it... Please someone should help 🙏
