### ISSUE TITLE
I'm running flanneld on 2 hosts which use udp device. When I first try to ping from hostA docker container to the hostB docker container, it fails, but then I try to ping from hostB docker container to the hostA docker container, it success. This is why?

### ISSUE THREAD

**Issue by ydhydhjanson** [coreos/flannel#342]
### docker info:
```
[root@localhost /]# docker version
 Version:      1.8.1.el7
 API version:  1.20
 Package Version: 
 Go version:   go1.5beta2
 Git commit:   4ae60f0-dirty
 Built:        Tue Aug 25 20:12:11 UTC 2015
 OS/Arch:      linux/amd64
```
```
[root@localhost /]# docker info
Containers: 13
Images: 67
Storage Driver: devicemapper
 Pool Name: docker-8:3-70034212-pool
 Pool Blocksize: 65.54 kB
 Backing Filesystem: xfs
 Data file: /dev/loop0
 Metadata file: /dev/loop1
 Data Space Used: 2.183 GB
 Data Space Total: 107.4 GB
 Data Space Available: 30.41 GB
 Metadata Space Used: 4.01 MB
 Metadata Space Total: 2.147 GB
 Metadata Space Available: 2.143 GB
 Udev Sync Supported: true
 Deferred Removal Enabled: false
 Data loop file: /var/lib/docker/devicemapper/devicemapper/data
 Metadata loop file: /var/lib/docker/devicemapper/devicemapper/metadata
 Library Version: 1.02.93-RHEL7 (2015-01-28)
Execution Driver: native-0.2
Logging Driver: json-file
Kernel Version: 3.10.0-229.4.2.el7.x86_64
Operating System: CentOS Linux 7 (Core)
CPUs: 4
Total Memory: 1.784 GiB
Name: localhost.localdomain
ID: WS5Y:RGIP:7ALW:CD3J:G57D:WPRY:ASB3:PGHF:6S46:M7CS:UEZ6:LM2N
WARNING: bridge-nf-call-iptables is disabled
WARNING: bridge-nf-call-ip6tables is disabled
```
### etcdctl  info:
```
[root@localhost flannel-master]# etcdctl --version
etcdctl version 2.1.1
```
### flannel info:
```
[root@localhost flannel-master]# cat version.go 
const Version = "0.5.3+git"
```
```
[root@localhost flannel-master]# etcdctl get /coreos.com/network/config
{"Network":"11.0.0.0/16","Backend":{"Type":"udp","Port":8285}}
```
### OS version:
```
[root@localhost /]# cat /etc/redhat-release
CentOS Linux release 7.1.1503 (Core) 
```
### flannel launch info:
```
[root@localhost bin]# ./flanneld -iface=eno16777736
I1010 09:57:45.242916 41162 main.go:111] Installing signal handlers
I1010 09:57:45.244223 41162 manager.go:106] Using 10.10.10.7 as external interface
I1010 09:57:45.244252 41162 manager.go:107] Using 10.10.10.7 as external endpoint
I1010 09:57:45.246501 41162 etcd.go:137] Found lease (11.0.44.0/24) for current IP (10.10.10.7), reusing
I1010 09:57:45.280408 41162 etcd.go:92] Subnet lease acquired: 11.0.44.0/24
I1010 09:57:45.284243 41162 manager.go:226] Running network 
I1010 09:57:45.296774 41162 udp.go:130] Watching for new subnet leases
I1010 09:57:45.298007 41162 udp.go:224] Subnet added: 11.0.86.0/24
I1010 09:58:30.932074 41162 udp.go:224] Subnet added: 11.0.86.0/24
```
### ipaddr info:
```
[root@localhost flannel-master]# ifconfig
docker0: flags=4163<UP,BROADCAST,RUNNING,MULTICAST>  mtu 1500
        inet 11.0.44.1  netmask 255.255.255.0  broadcast 11.0.44.255
        inet6 fe80::42:a8ff:feac:3069  prefixlen 64  scopeid 0x20<link>
        ether 02:42:a8:ac:30:69  txqueuelen 0  (Ethernet)
        RX packets 35380  bytes 2593652 (2.4 MiB)
        RX errors 0  dropped 0  overruns 0  frame 0
        TX packets 15673  bytes 21244116 (20.2 MiB)
        TX errors 0  dropped 0 overruns 0  carrier 0  collisions 0

eno16777736: flags=4163<UP,BROADCAST,RUNNING,MULTICAST>  mtu 1500
        inet 10.10.10.7  netmask 255.255.255.0  broadcast 10.10.10.255
        inet6 fe80::250:56ff:fe38:34ee  prefixlen 64  scopeid 0x20<link>
        ether 00:50:56:38:34:ee  txqueuelen 1000  (Ethernet)
        RX packets 9269256  bytes 1064090005 (1014.7 MiB)
        RX errors 0  dropped 0  overruns 0  frame 0
        TX packets 9258138  bytes 910438092 (868.2 MiB)
        TX errors 0  dropped 0 overruns 0  carrier 0  collisions 0

flannel0: flags=4305<UP,POINTOPOINT,RUNNING,NOARP,MULTICAST>  mtu 1472
        inet 11.0.44.0  netmask 255.255.0.0  destination 11.0.44.0
        unspec 00-00-00-00-00-00-00-00-00-00-00-00-00-00-00-00  txqueuelen 500  (UNSPEC)
        RX packets 8  bytes 672 (672.0 B)
        RX errors 0  dropped 0  overruns 0  frame 0
        TX packets 22  bytes 1848 (1.8 KiB)
        TX errors 0  dropped 0 overruns 0  carrier 0  collisions 0

lo: flags=73<UP,LOOPBACK,RUNNING>  mtu 65536
        inet 127.0.0.1  netmask 255.0.0.0
        inet6 ::1  prefixlen 128  scopeid 0x10<host>
        loop  txqueuelen 0  (Local Loopback)
        RX packets 37115  bytes 2054533 (1.9 MiB)
        RX errors 0  dropped 0  overruns 0  frame 0
        TX packets 37115  bytes 2054533 (1.9 MiB)
        TX errors 0  dropped 0 overruns 0  carrier 0  collisions 0

veth6b1482f: flags=4163<UP,BROADCAST,RUNNING,MULTICAST>  mtu 1500
        inet6 fe80::60d4:f8ff:fea7:4ef1  prefixlen 64  scopeid 0x20<link>
        ether 62:d4:f8:a7:4e:f1  txqueuelen 0  (Ethernet)
        RX packets 4518  bytes 430328 (420.2 KiB)
        RX errors 0  dropped 0  overruns 0  frame 0
        TX packets 1559  bytes 141110 (137.8 KiB)
        TX errors 0  dropped 0 overruns 0  carrier 0  collisions 0
```
### route info:
```
[root@localhost flannel-master]# route
Kernel IP routing table
Destination     Gateway         Genmask         Flags Metric Ref    Use Iface
default         joywifi.net     0.0.0.0         UG    100    0        0 eno16777736
10.10.10.0      0.0.0.0         255.255.255.0   U     100    0        0 eno16777736
11.0.0.0        0.0.0.0         255.255.0.0     U     0      0        0 flannel0
11.0.44.0       0.0.0.0         255.255.255.0   U     0      0        0 docker0
```
### arp info:
```
[root@localhost flannel-master]# arp -n
Address                  HWtype  HWaddress           Flags Mask            Iface
10.10.10.8               ether   00:50:56:2e:46:26   C                     eno16777736
11.0.44.5                ether   02:42:0b:00:2c:05   C                     docker0
10.10.10.254             ether   00:1c:c2:18:d9:a6   C                     eno16777736
```
### fdb info:
```
[root@localhost flannel-master]# bridge fdb
01:00:5e:00:00:01 dev eno16777736 self permanent
33:33:00:00:00:01 dev eno16777736 self permanent
33:33:ff:38:34:ee dev eno16777736 self permanent
01:00:5e:00:00:fb dev eno16777736 self permanent
02:42:a8:ac:30:69 dev docker0 permanent
62:d4:f8:a7:4e:f1 dev veth6b1482f permanent
62:d4:f8:a7:4e:f1 dev veth6b1482f vlan 1 permanent
16:22:89:62:d5:6b dev docker0 vlan 1 permanent
02:42:a8:ac:30:69 dev docker0 vlan 1 permanent
ea:b1:30:03:df:cb dev flannel.1 dst 10.10.10.8 self permanent
33:33:00:00:00:01 dev veth6b1482f self permanent
01:00:5e:00:00:01 dev veth6b1482f self permanent
33:33:ff:a7:4e:f1 dev veth6b1482f self permanent
```
### flannel launch info:
```
[root@localhost bin]# ./flanneld -iface=eno16777736
I1010 09:58:30.740267 97050 main.go:111] Installing signal handlers
I1010 09:58:30.755966 97050 manager.go:106] Using 10.10.10.8 as external interface
I1010 09:58:30.756036 97050 manager.go:107] Using 10.10.10.8 as external endpoint
I1010 09:58:30.810294 97050 etcd.go:137] Found lease (11.0.86.0/24) for current IP (10.10.10.8), reusing
I1010 09:58:30.893516 97050 etcd.go:92] Subnet lease acquired: 11.0.86.0/24
I1010 09:58:30.929770 97050 manager.go:226] Running network 
I1010 09:58:30.929807 97050 udp.go:130] Watching for new subnet leases
I1010 09:58:31.063745 97050 udp.go:224] Subnet added: 11.0.44.0/24
```
### ipaddr info:
```
[root@localhost ~]# ifconfig
docker0: flags=4163<UP,BROADCAST,RUNNING,MULTICAST>  mtu 1500
        inet 11.0.86.1  netmask 255.255.255.0  broadcast 11.0.86.255
        inet6 fe80::42:a1ff:fe52:d81b  prefixlen 64  scopeid 0x20<link>
        ether 02:42:a1:52:d8:1b  txqueuelen 0  (Ethernet)
        RX packets 15664  bytes 1043895 (1019.4 KiB)
        RX errors 0  dropped 0  overruns 0  frame 0
        TX packets 14503  bytes 19060799 (18.1 MiB)
        TX errors 0  dropped 0 overruns 0  carrier 0  collisions 0

eno16777736: flags=4163<UP,BROADCAST,RUNNING,MULTICAST>  mtu 1500
        inet 10.10.10.8  netmask 255.255.255.0  broadcast 10.10.10.255
        inet6 fe80::250:56ff:fe2e:4626  prefixlen 64  scopeid 0x20<link>
        ether 00:50:56:2e:46:26  txqueuelen 1000  (Ethernet)
        RX packets 9235553  bytes 1072119091 (1022.4 MiB)
        RX errors 0  dropped 0  overruns 0  frame 0
        TX packets 9429367  bytes 922332537 (879.6 MiB)
        TX errors 0  dropped 0 overruns 0  carrier 0  collisions 0

flannel0: flags=4305<UP,POINTOPOINT,RUNNING,NOARP,MULTICAST>  mtu 1472
        inet 11.0.86.0  netmask 255.255.0.0  destination 11.0.86.0
        unspec 00-00-00-00-00-00-00-00-00-00-00-00-00-00-00-00  txqueuelen 500  (UNSPEC)
        RX packets 8  bytes 672 (672.0 B)
        RX errors 0  dropped 0  overruns 0  frame 0
        TX packets 8  bytes 672 (672.0 B)
        TX errors 0  dropped 0 overruns 0  carrier 0  collisions 0

lo: flags=73<UP,LOOPBACK,RUNNING>  mtu 65536
        inet 127.0.0.1  netmask 255.0.0.0
        inet6 ::1  prefixlen 128  scopeid 0x10<host>
        loop  txqueuelen 0  (Local Loopback)
        RX packets 46819  bytes 3376959 (3.2 MiB)
        RX errors 0  dropped 0  overruns 0  frame 0
        TX packets 46819  bytes 3376959 (3.2 MiB)
        TX errors 0  dropped 0 overruns 0  carrier 0  collisions 0

veth15b13bf: flags=4163<UP,BROADCAST,RUNNING,MULTICAST>  mtu 1500
        inet6 fe80::a0c8:bff:fe30:df3b  prefixlen 64  scopeid 0x20<link>
        ether a2:c8:0b:30:df:3b  txqueuelen 0  (Ethernet)
        RX packets 7870  bytes 646184 (631.0 KiB)
        RX errors 0  dropped 0  overruns 0  frame 0
        TX packets 8580  bytes 10470979 (9.9 MiB)
        TX errors 0  dropped 0 overruns 0  carrier 0  collisions 0
```
### route info:
```
[root@localhost ~]# route
Kernel IP routing table
Destination     Gateway         Genmask         Flags Metric Ref    Use Iface
default         joywifi.net     0.0.0.0         UG    100    0        0 eno16777736
10.10.10.0      0.0.0.0         255.255.255.0   U     100    0        0 eno16777736
11.0.0.0        0.0.0.0         255.255.0.0     U     0      0        0 flannel0
11.0.86.0       0.0.0.0         255.255.255.0   U     0      0        0 docker0
```
### arp info:
```
[root@localhost ~]# arp -n
Address                  HWtype  HWaddress           Flags Mask            Iface
11.0.86.5                ether   02:42:0b:00:56:05   C                     docker0
10.10.10.254             ether   00:1c:c2:18:d9:a6   C                     eno16777736
10.10.10.7               ether   00:50:56:38:34:ee   C                     eno16777736
```
### fdb info:
```
[root@localhost ~]# bridge fdb
01:00:5e:00:00:01 dev eno16777736 self permanent
33:33:00:00:00:01 dev eno16777736 self permanent
33:33:ff:2e:46:26 dev eno16777736 self permanent
01:00:5e:00:00:fb dev eno16777736 self permanent
33:33:00:00:02:02 dev eno16777736 self permanent
02:42:a1:52:d8:1b dev docker0 permanent
0e:36:19:10:d6:53 dev docker0 vlan 1 permanent
a2:c8:0b:30:df:3b dev veth15b13bf permanent
a2:c8:0b:30:df:3b dev veth15b13bf vlan 1 permanent
02:42:a1:52:d8:1b dev docker0 vlan 1 permanent
c2:de:dc:d7:b1:89 dev flannel.1 dst 10.10.10.7 self permanent
33:33:00:00:00:01 dev veth15b13bf self permanent
01:00:5e:00:00:01 dev veth15b13bf self permanent
33:33:ff:30:df:3b dev veth15b13bf self permanent
```
## the results I received
 I first try to ping from hostA docker container to the hostB docker container, it fails
```
root@testrc-ig1d0:/usr/local/tomcat# ping 11.0.86.5
PING 11.0.86.5 (11.0.86.5): 56 data bytes


```
in hostB tcpdump eno16777736,
```
[root@localhost ~]# tcpdump -i eno16777736 | grep ICMP
tcpdump: verbose output suppressed, use -v or -vv for full protocol decode
listening on eno16777736, link-type EN10MB (Ethernet), capture size 65535 bytes
11:09:37.524284 IP localhost.localdomain > 10.10.10.7: ICMP host localhost.localdomain unreachable - admin prohibited, length 120
11:09:38.525247 IP localhost.localdomain > 10.10.10.7: ICMP host localhost.localdomain unreachable - admin prohibited, length 120
11:09:39.528013 IP localhost.localdomain > 10.10.10.7: ICMP host localhost.localdomain unreachable - admin prohibited, length 120
11:09:40.619891 IP localhost.localdomain > 10.10.10.7: ICMP host localhost.localdomain unreachable - admin prohibited, length 120
11:09:41.530545 IP localhost.localdomain > 10.10.10.7: ICMP host localhost.localdomain unreachable - admin prohibited, length 120
```
in hostB ping 11.0.86.5
```
[root@localhost ~]# ping 11.0.86.5
PING 11.0.86.5 (11.0.86.5) 56(84) bytes of data.
64 bytes from 11.0.86.5: icmp_seq=1 ttl=64 time=0.178 ms
64 bytes from 11.0.86.5: icmp_seq=2 ttl=64 time=0.065 ms
64 bytes from 11.0.86.5: icmp_seq=3 ttl=64 time=0.062 ms
```
then I try to ping from hostB docker container to the hostA docker container, it success
```
[root@leavewordrc-359ug lib]# ping 11.0.44.5
PING 11.0.44.5 (11.0.44.5) 56(84) bytes of data.
64 bytes from 11.0.44.5: icmp_seq=1 ttl=60 time=9.50 ms
64 bytes from 11.0.44.5: icmp_seq=2 ttl=60 time=2.13 ms
64 bytes from 11.0.44.5: icmp_seq=3 ttl=60 time=0.509 ms
```
```
root@testrc-ig1d0:/usr/local/tomcat# ping 11.0.86.5
PING 11.0.86.5 (11.0.86.5): 56 data bytes
64 bytes from 11.0.86.5: icmp_seq=100 ttl=60 time=1.518 ms
64 bytes from 11.0.86.5: icmp_seq=101 ttl=60 time=0.815 ms
64 bytes from 11.0.86.5: icmp_seq=102 ttl=60 time=0.869 ms
```
closing ping, after about a minute, I again try to ping from hostA docker container to the hostB docker container, it fails. 
## the results I expected
```
 I first try to ping from hostA docker container to the hostB docker container, it should success.
```

**Comment by eyakubovich** [comment]
@ydhydhjanson Apologies for the late response -- GitHub has been weird lately with notifications and such.

Two things. First, the "Port" field can be left out if you're ok with default (8285) but if you do specify, it's just a number `"8285"`, not `":8285"`.

Second, `11:09:37.524284 IP localhost.localdomain > 10.10.10.7: ICMP host localhost.localdomain unreachable - admin prohibited, length 120` says that there's a firewall rule blocking this traffic. Can you check your host B to make sure it allows UDP traffic on 8285 from your host A. Are you using firewalld or another firewall software?

**Comment by ydhydhjanson** [comment]
Thanks to @eyakubovich , has found a problem , I expose 8285 port like this : firewall-cmd --add-port=8285/tcp , be revised as : firewall-cmd --add-port=8285/udp , flannel successful working !
